reviewId,userName,userImage,content,score,thumbsUpCount,reviewCreatedVersion,at,replyContent,repliedAt,sortOrder,appId
gp:AOqpTOEtXWQi9mKhDNSyiDwGzaWH9nShfil1AvK8fM-pMV3z4EpVpOOKc8OqR6x5MOi_A7es-lPccS1hpy6ZhA,Kristiantaake Person,https://play-lh.googleusercontent.com/a-/AOh14GinoNtHKQ42ZZo9Hp8UL7Ip1N7uSxlraH_UApbj,I recently downloaded the app and it says the the app is currently unavailable. Is this a common thing to happen or is the app under maintenance? Please let me know what I should do because I'd like to see how the app works. Thanks,1,5,2.1.2.0,2020-04-21 19:12:53,"Hi Kristiantaake, 

Thank you for letting us know and we apologise for the inconvenience. If you're trying to login during regular maintenance times in the late evenings (Fiji time); please try to login during the day (Fiji time). If the problem persists, please call us on +679 331 6644, so our support staff can resolve this asap.

Thank you,
TM",2020-06-02 04:51:46,most_relevant,com.anz.anzpacific
gp:AOqpTOEmEhWcXE_R2wjWJliVTgnTgATVjQjgpUXRQ8ZQU8ORJD1zXqwvNjlCjBJQrwlpRF2sqgg4DHNyIB1BIw,core blimey,https://play-lh.googleusercontent.com/a/AATXAJwy4f5-AKl0ZsrZFPwXJRPITL-vrF2_JboMX7OQ=mo,Have loaded this app twice .i get the main page and thats it .make it worse old app no longer supported .need to transfer over but cant .stuck where i am till bisness hours open completely upsetting rating at this stage -2,1,6,,2020-09-14 23:16:07,"Hi Core,

Please try and re-installing the App from Play Store. If the problem persists, please reach out to our Contact Centre on +679 331 6644.

Thank you,
TM",2020-09-16 05:07:23,most_relevant,com.anz.anzpacific
gp:AOqpTOErNUtvS9Stz4XUcKZCVw940Izce4tG9UGNrEAyshHISYtxJ8xx7GMfOZijGysABXDdUi-lwzyiqK8KWA,Justin Thaggard,https://play-lh.googleusercontent.com/a-/AOh14GjY4R_Gk3NJ-63562RxgRHvWjxrF3MZnAxHYRmj5w,Been having alot of issues with this app. Worked fine before and lately just been giving me constant problems with logging in. Please fix this issue ASAP,1,1,1.0.2.0,2019-09-24 06:23:14,,,most_relevant,com.anz.anzpacific
gp:AOqpTOGd4-yEmmhVS_0gntoTnvUTsnfz-iRwJ3ah6fWjsOujrOosVA_iyuQV5LNm2RFxDgv1IR-eyg_OKd68_Q,Rìmal Yogesh Kumar,https://play-lh.googleusercontent.com/a-/AOh14GiMMsM73yb7L1Ady-VtcQpyZ29rNEhZ74vN9nfEXw,"After pressing my Password several times.. Account gets blocked, My internet is excellent But This app has Too many glitches..",1,2,2.1.2.0,2020-09-15 11:17:42,"Hi Rimal,

We are sorry to hear that you are having problems logging in to our App. Please call our Contact Centre on 331 6644 for assistance.

Thanks,
TM",2020-09-16 05:04:35,most_relevant,com.anz.anzpacific
gp:AOqpTOGQ-6nHIpJvNG0ZwwD3ptrjQ6VhJaX1Z1oVLTRjO9tCbZSKXTQXxsBdpGzz0oU4m1SvSO5uoUZbcvVErg,Aswin Sumer,https://play-lh.googleusercontent.com/a/AATXAJxhyO-evb6KLo1VMyeIc3mj8uI19PRrwddXVTgs=mo,"Poor, can not log in with the app. But works on web page.",1,1,2.1.2.0,2020-08-09 13:47:56,"Hi Aswin,

Sorry to hear that you are having issues logging in to our App. Please call our Contact Centre on +679 331 6644 so we can have this resolved at the earliest.

Thank you,
TM",2020-09-16 05:21:13,most_relevant,com.anz.anzpacific
gp:AOqpTOFK25AHz_Qy3p_dNzb8yHS9T-iltZvanupYqJNilWvS2EEkoTQja2HwIXFrV76AbkQatFHM4mtCijWN5A,Razia Begum,https://play-lh.googleusercontent.com/a-/AOh14GgH3Gp79vc2Yd5eIcHaXpAUuYEoDuzBEAFvR3Bnkw,cant use app wen u need it. its always loads and gives you an error if connecting problems always have to replace password and logins,1,12,2.1.0.0,2019-07-25 17:03:11,,,most_relevant,com.anz.anzpacific
gp:AOqpTOGfYQCc36x8FvSsrO7i4nHuR02PNrvDJahXN1TKwBA-LfOFNUJsKOMfSmWpx8wjC8gU-zgg4vwe0f0WIQ,Nancy,https://play-lh.googleusercontent.com/a-/AOh14GgbuOi052i87prHzGRel3DiiBs1zqleBmAtjpvO,"just downloaded, cannot even open the app, blank white screen. tried a few times iths still the same",1,4,2.1.2.0,2020-03-22 06:37:51,"Hi Nancy, 

I'm sorry to hear you are having issues with our app. The minimum android operating system for our App is Android 5.0 and we can see that your device is on Android 4.4. 

Please try installing our App on a device with Android 5.0 or above. 

Regards, 
TM",2020-03-26 08:15:16,most_relevant,com.anz.anzpacific
gp:AOqpTOH4nrLsFQAs1A9v9Z1yXywHjvOeVo6RFROps4zfwyY-EsoUBSZ72TbtG0LqP8ndfflEIEaGTIb7HMt7Og,Josh Coffey,https://play-lh.googleusercontent.com/a/AATXAJyQysZKrHuZ-YajyxkaQmUx2rO1jc18zZcyU_zy=mo,This app doesnt work. Why has it changed from original app? Very frustrating to say the least. Pleae sort it out.,1,0,,2020-09-22 15:05:49,,,most_relevant,com.anz.anzpacific
gp:AOqpTOH3lA3RlASneq4GqdMaLXhZWGU-gcwgxEccBPyENIZJ7rrAX78tLsqKlujW4F1d4NO5gbgtroxX7mERtg,Ajesh Maharaj,https://play-lh.googleusercontent.com/a/AATXAJy98vksHEsdGnIUzTBjXQOoJBywfmTKuj7Ug29d=mo,Useless app. Its says app is unavailable whenever I try to log in.,1,0,,2020-12-02 15:35:59,,,most_relevant,com.anz.anzpacific
gp:AOqpTOFbWQgM-Z05ykF9TViprmLkcyl0GxTMtWDbw-XYv_ghWkPkxljcZAhHMZ2DbqKP7xHaGQJsHWA6j9rvCw,Alvis Kumar,https://play-lh.googleusercontent.com/a-/AOh14GgYR75LAHHwR3ZKgDaGTw44sLOJg1PRZT1fkf5-5Q,"Need new update Everytime i log in ask for my user id , password and security questions... Patch this app",1,1,2.1.1.0,2019-12-19 09:16:41,,,most_relevant,com.anz.anzpacific
gp:AOqpTOGCdGPGz5qQFzJX7vkUnG-Qt7V6B3MsIO_PKHrxs8odQuZDW2W-ayRRdmhW5BJOfYqYaAIoZtKY2xNyhQ,Jules Picard,https://play-lh.googleusercontent.com/a/AATXAJyEUgCSgQgWeg7sSLnpB_2kB53KaJuel0KAb-Q8=mo,Just another useless app from ANZ. Doesn't even open. I'm taking my money to another bank.,1,30,2.0.1.0,2019-02-16 11:58:06,,,most_relevant,com.anz.anzpacific
gp:AOqpTOFUk2KGNtuP8B0qqh0KbfgCsV-A80zh2haVgcyR8-J9SlBgR_eGw6GlQJzRS2spepB2REj-1M0d9rovTw,sally hardwick,https://play-lh.googleusercontent.com/a/AATXAJwC8u1RGxDnBeY8xLizp7moCPLN7J_Bc0O1FjLk=mo,Pacific page wont open. Ridiculous a banking group constantly fks up..,1,0,,2019-11-28 13:26:11,,,most_relevant,com.anz.anzpacific
gp:AOqpTOF3_y1bnxEeNEUmxBmby4wEnohHh5cj6a3yrx2L3Mzg5Yk3k-sfc8hgBjBeMVA2zKDVmRXKloc_ZG8R6Q,Jessica Jakab,https://play-lh.googleusercontent.com/a-/AOh14GiP4E6wHiUhN0DtxMreF1TKFmixAMwrEsJ0QpY0epY,Doesn't start. program stuck at ANZ logo.,1,5,2.0.1.0,2019-03-11 13:49:01,,,most_relevant,com.anz.anzpacific
gp:AOqpTOEA3mwgvN0GXIH6E-p9dTISp9f5x3oS3odzPMwkQTrQkTlbZKE3Z5jHdF4iir7JRy96dA5ZssT65WXWww,Waqaniasease Manasa,https://play-lh.googleusercontent.com/a/AATXAJwLVIVnb1J4WHUF-X7eR7es8nSdGv-xH8EwVY1-=mo,Very helpful in a faster way of updating your account,1,0,2.1.2.0,2021-02-03 15:37:54,,,most_relevant,com.anz.anzpacific
gp:AOqpTOF76TpKHVeuiVGvg4VUPFKlnydmp9bQVsuTn18LpcDblshDpFcp3qPzEVVeHepRLZY-eBDg-MDcv5zhQw,DJ Nishchal,https://play-lh.googleusercontent.com/a-/AOh14Ghe0pHpf6pPRB7ETDrnz7QxMEtWuMIve00_qQeY4g,Keeps getting to the login screen always,1,1,2.1.1.0,2020-01-07 14:28:13,,,most_relevant,com.anz.anzpacific
gp:AOqpTOEL6muhKpIKp4MmNmR-qA7uQL5_jQiFU3dqjdpoZvn_X2P_JK_uYR5TxV2cQuPausfvAPSR99Gjlu07nA,mostafa gabr,https://play-lh.googleusercontent.com/a/AATXAJx5PvpPT6UKFo4Xc0q2dLARFdJkAkAQkHqjJP8_=mo,"The bank itself is full of unqualified staff, I have a problem for six months now not solved,",1,0,2.1.2.0,2021-06-07 16:38:23,,,most_relevant,com.anz.anzpacific
gp:AOqpTOHH87WAOi5pW9cSofMpANoAb91wZa_2VzPYE_xgbCEIAyJC8utOp-o6e8EmecKFESDNfZ79zLcGs9JvUQ,Ben Aspinall,https://play-lh.googleusercontent.com/a/AATXAJzbDRDcf4WlLFAnXc6ENIMaK01QYHLpSRWs49Um=mo,can't open either this or the updated app on my phone ridiculous. what the hell is going on.,1,3,2.0.0.0,2019-01-09 15:46:15,,,most_relevant,com.anz.anzpacific
gp:AOqpTOFBxnDs1hJKGuyZpxEdhzDx_ySqzXoC3_KobFgyob0uUJlbA7z4faA_HbRWBEjCN4WlASnEoCB6aE7nGA,Edward Hills,https://play-lh.googleusercontent.com/a-/AOh14GhwQoUeqSQhNMTgU-X9zKFkpcZDzGWaPVrUocrmMw,Couldn't even log back in after setting up,1,0,2.1.2.0,2020-08-27 07:04:18,"Hello,

We recommend that you call our Contact Centre on +679 331 6644 for assistance.

Thank you,
TM",2020-09-16 05:10:48,most_relevant,com.anz.anzpacific
gp:AOqpTOF3ZLeTRFJo7DHN06LdbhfEharpH09wm6zRHOH5KbkMID8fMFc01PYey4521AG8tndX7QW10YfaF6kJtA,Jly Luvuiyasawa,https://play-lh.googleusercontent.com/a-/AOh14GigLW-q7KeVRM7LpePr76t-3kdxvf_SpamvMt7C,Useless app...developers needs development. Apps keeps on crashing,1,0,2.1.2.0,2020-12-03 15:27:29,,,most_relevant,com.anz.anzpacific
gp:AOqpTOFGqx5ty5Yyrig6gtz18-ExAx8RQOQYM-MqfY_ZzAQZ0AJYkuCTGlVb-NyrU2RXI8nFoIraT6aVsujRcw,vineet vishal chandra,https://play-lh.googleusercontent.com/a/AATXAJw1iowGwvW79ADiwUth2nkBXFYeImsgC2N_Q_j-=mo,App was good but started freezing.,1,0,1.0.2.0,2019-12-03 10:28:26,,,most_relevant,com.anz.anzpacific
gp:AOqpTOGm5QXL18e44ujY4Y75YNhhKThpQBZs9zDJwGuX_G5LQRo25aNXx1wZfJeoQhIvoQIOSub4bZseH4QuOA,MEGATRON 99,https://play-lh.googleusercontent.com/a-/AOh14Gg8oXOnGqsSH_-F14tLkivZm83DwQ5b-XjkCrPwjg,Unable to login now. Eventhough my user and password are correct. Please help,1,0,2.1.2.0,2020-02-17 11:00:25,"Hi Mis.

I'm sorry to hear you're having issues with our app. 

Please call our Contact Centre on +679 331 6644 to help resolve your login issue. 

Thanks,
TM",2020-03-27 09:00:54,most_relevant,com.anz.anzpacific
gp:AOqpTOEAVdHvvDofAh5WIGejhhyUS15_K235_FWBuYQD9DnnFh_t3K8vP5E7Qco0SSf3mZ7mxRmHoM2Pk_IYZg,devika nanda,https://play-lh.googleusercontent.com/a-/AOh14GiAyPnLJaE-3MV0U443HlGhZKLIeH_4R_Y6Fv3nAQ,Everytime i use it says internet banking services is currently unavailable why,1,0,,2020-07-15 16:36:31,"Hi Devika,

This may be due to the App not being installed yet on your device. 
Please call our Contact Center on +679 331 6644 for further assistance.

Regards,
TM",2020-07-27 10:32:46,most_relevant,com.anz.anzpacific
gp:AOqpTOHs7s4iLrJxsCxhbfJRv0-dmLcYXkOwF3cXMIayMVmsuU6Vfj20mMN53OUwY_cLOANTH8Us6yVzYBg_4A,Jay Breezy,https://play-lh.googleusercontent.com/a-/AOh14Ghs2c1UmwDDndeM9cpqBBFLd4Pa-zOcMd66FjCMkg,I hate this app. I can't even log in.😡😡,1,1,2.0.1.0,2019-03-24 08:42:34,,,most_relevant,com.anz.anzpacific
gp:AOqpTOG_oIFKmk-Fko3Lw1kE9bXzDG59HS4ugPAvv_Px2k-DGx2sdv_bJaxnChGV9IV6GIODHACQXvY_ED2NyQ,Chris D K,https://play-lh.googleusercontent.com/a-/AOh14GiliJNcTs4g7hGS6uMmSq-j1yBhbdqHM6jopfUQ7g,Screen frozen on ANZ Pacific intro,1,2,2.1.0.0,2019-09-12 11:20:26,,,most_relevant,com.anz.anzpacific
gp:AOqpTOFcsIDK5YH6RuVlvh1GlxX6R0Jk_KPiEIbe1DfxnUQc_EQwS4dVEJJpr5drDWDGnSuQWtFJyU77jSDtXg,Telegani Ruialamo,https://play-lh.googleusercontent.com/a/AATXAJz29ihsOkamAeBTuitVx-146GjN4nHFFmBIUWY3=mo,This does not open. Tried all day but no response.,1,0,2.1.2.0,2020-11-26 13:17:34,,,most_relevant,com.anz.anzpacific
gp:AOqpTOHhmBaruUK0ZfStOVo4vZhHb1j8jede-QN4wwYUnPnJZ_QkgD9pZS76sWAQOTyS7Pnld6SXOf99iyUk_g,Christopher Kagl,https://play-lh.googleusercontent.com/a-/AOh14GgRJr3M3Y5OtP5pV8j70D7iS5PhWASLHE9O_3L4SA,Pretty useless. Doesn't even open. Don't download!!!,1,3,2.0.1.0,2019-04-26 08:46:23,,,most_relevant,com.anz.anzpacific
gp:AOqpTOGRjm73FnZpyvcbn40mdn5vuoRM3xdlMZMDosGGHI_K_M7LCzY-6m1qDpWHjCTjLD02wuyF5I3nxX0Zrw,Danielle Stoyles,https://play-lh.googleusercontent.com/a-/AOh14GgRGrWTnGmYbOYjwSNT91X2Rr07dkmp5WZcvBd7,absolutely useless. Doesn't even open,1,3,2.0.1.0,2019-02-19 01:35:08,,,most_relevant,com.anz.anzpacific
gp:AOqpTOHWIySee6XpP3yMD4Rqh7i6n4oRFCNXVydsz05A3HHu2kawj438SIlfstwUIy-lOWBWVaqztC0lxZnzZQ,Calvary Bible Study,https://play-lh.googleusercontent.com/a-/AOh14GjKOIoiMkBJrQZWdSeR46UVhNTSp2QhmcF2BS7xpg,Freezesb at start-up.,1,0,2.1.2.0,2020-10-06 20:48:49,,,most_relevant,com.anz.anzpacific
gp:AOqpTOHYEy0EQqRplBDKzLDYKVsaVelAqsOmu5OgXCvFyNqnT0smdXbxOAsdIproJYcSjnbUWuQRyln_AqHBnw,Bernard Murdoch,https://play-lh.googleusercontent.com/a-/AOh14GiLiGbQR_YRLh8TvNWLyr8AmwP5sb3C3RWU1y23,The app Could not open in my country,1,0,2.1.2.0,2020-05-07 10:33:43,"Hi Bernard,

Thank you for your feedback and we apologise for any inconvenience. Please visit your nearest branch or contact our call centre on +679 331 6644 to investigate this further. 

Thank you,
TM",2020-06-02 04:54:32,most_relevant,com.anz.anzpacific
gp:AOqpTOEdo2hXVR4EBXwjjnKQqVq9jFJPCgKdI1siCoK980R6TEeC4CywE4OpqA9noseha7rF-1CxPmaVTOxgrg,Chris Jordan,https://play-lh.googleusercontent.com/a/AATXAJzTQladmQmwrg7HR77dOgxOqyFEGZ7m4-Co2d9S=mo,"No experiance here, cant even open it",1,0,2.1.2.0,2020-08-21 08:55:13,"Hi Chris,

The minimum operating system for Android is 5.0 and above. We can see that you are using a device with an older operating system. Please install the App on a device with a later operating system and let us know if you have any issues.

Thanks,
TM",2020-09-16 05:17:34,most_relevant,com.anz.anzpacific
gp:AOqpTOFnjCfidwxbeLvL6FafcCptdseuRBsPd432GvC6OOGxy0nAlDKnA8tceU8igV4O-ah5WOHtTKjVu4S3oA,Karma Jimba,https://play-lh.googleusercontent.com/a-/AOh14GhfqWb0rLoE9t3x78w7CLcdaDr_p4tG-L7iG0qbtA,why cant it operate from other countries? It provides only local flavour.,1,0,2.0.1.0,2019-04-28 10:01:08,,,most_relevant,com.anz.anzpacific
gp:AOqpTOHvWNsJ2GvjtbSjKe4ujOpWiQ7C14_ltkukzWC4Wxup8Fi86b342rtyvHp7Bxpz_aMne74TXq2RthoLxQ,Shane Ashwell,https://play-lh.googleusercontent.com/a/AATXAJyOSvvPC_yjGK4LC1WvG7SfKWt3u7I2ARb1VC04=mo,"Doesn't download, it's not the right app, where is the correct app.",1,0,2.1.2.0,2020-09-18 18:55:56,,,most_relevant,com.anz.anzpacific
gp:AOqpTOFNSNLnFyQPAmUw7c4WOXMZgox6JbZuPdZb9bEuyyKtdr_3dwsN1XC_GwsRNwsduQz78HJQalRu96pbvA,Priya Maharaj,https://play-lh.googleusercontent.com/a/AATXAJy-Fsc9Ncu3MEECsUbrR-IavGLFFzjSJVDZCqmU=mo,Very slow in updating,1,0,,2020-03-01 09:31:08,"Hi Priya,

I'm sorry to hear you're having issues with our app. Could you check the internet connectivity in your area and try again. 

If the problem persists, please call our Contact Centre on +679 331 6644.

Thanks,
TM",2020-03-26 08:24:01,most_relevant,com.anz.anzpacific
gp:AOqpTOGVQeAUChAvLKCmGakWGeJSDJTnX0tEA9K2Xz9Gl96jMX3coW7tYV7WfuaDWwxdVQcmHVRIkqlxs8dBWQ,bev gibbs,https://play-lh.googleusercontent.com/a/AATXAJxEz4Kyxy74RiMsFeI6BsIUa1r4l-vS5GC4K90y=mo,Useless for someone with an old mobile.,1,0,2.1.2.0,2020-08-26 14:59:11,"Hi Bev,

Sorry to hear you are having issues with our app. Older versions of Android have security vulnerabilities, hence we only avail our App on the new android version to help protect our customer’s funds. 

Regards, 
TM",2020-09-16 05:15:26,most_relevant,com.anz.anzpacific
gp:AOqpTOGaUmDZk9SP9N_whn3yv5M3JdGDvgWPCzEP4uLajFGNbtkvCTutnjP4d1dcg4unAnYtjrN1iCqppTsfMQ,Taylar Tupou,https://play-lh.googleusercontent.com/a-/AOh14Ggt81fZGr0mX_WSbSWr0TUpED8Ch7h1LCgJMETc,i just installed it and it wont open. Only shows a page saying anz pacific,1,3,2.1.0.0,2019-09-24 12:28:28,,,most_relevant,com.anz.anzpacific
gp:AOqpTOGkZyKFk1TqDVv3DnXkvCy3pTXdyOQlbFB7wq_Weqp1y_5m-X7Hyz69YZ2AmQxQqYEk0ybTQwOFYRIQXw,bebe tamoaieta,https://play-lh.googleusercontent.com/a-/AOh14Gi_xZ0NXOFtxs0JzXrGbdaatYjAGTkBSST9UnWN,The app can't be open,1,0,2.1.2.0,2020-02-10 05:14:32,"Hi Bebe,

I'm sorry to hear you are having issues with our app.

The minimum android operating system for our App is Android 5.0 and we can see that your device is on Android 4.4. 

Please install our App on a device with Android 5.0 or above. 

Regards,
TM",2020-03-27 09:16:23,most_relevant,com.anz.anzpacific
gp:AOqpTOErtnL6aEU2fzMAMqXouRlUjPH-8MDxzEwsHmYmbfwfxU7OZVBu2urcrjCm7BEOugX0QyY0DdEE4mfvTw,Deepak Lal,https://play-lh.googleusercontent.com/a-/AOh14GheMBAttqqt0SxuyggE7rQVp1f7BfT9LkZ5tw1C,This app stops working after updating,1,0,2.0.1.0,2019-09-11 04:22:39,,,most_relevant,com.anz.anzpacific
gp:AOqpTOFra28JxItIXFjlIv_B6shCfn4yWxgTwoNG5qcbLUGgtKAJh3f2thEocO6ABNq4wF8LBikmqok_tSZQeQ,Marie-Claire Ferrante,https://play-lh.googleusercontent.com/a/AATXAJx7fB6Ksjy9ZwxogzH4Oe7Y3ZBPieRAIxwvsdx8=mo,The app doesn't open so it's useless.,1,1,,2019-03-14 04:03:01,,,most_relevant,com.anz.anzpacific
gp:AOqpTOGmjif5h5gjtFaxuh9KqyV3FHx73FJF8V8KOeIH3Lj8RbysmHpsL5LuFz8XfVkqfjXvbi9Of8a9LW8Y9w,jainesh Kumar,https://play-lh.googleusercontent.com/a/AATXAJwywvhXPlovPFIyPn88UTrshOaz3T8c6wuq1qCV=mo,Upon update have to fill in from start user n password,1,0,,2020-01-20 13:24:27,,,most_relevant,com.anz.anzpacific
gp:AOqpTOETpldTpS0RubrZzaI28DNWHHwtx6PeGHnXvG_USWU6cnE6EQIBo8XUwAGWfBC83bICvjB1G6gUwNbQKg,Viliame Leqa,https://play-lh.googleusercontent.com/a-/AOh14Ggoq5LUr5kAVUipWyaU25hp1gg8Nbl5dmtGiTrx,Does not open!,1,2,1.0.2.0,2019-03-20 18:04:42,,,most_relevant,com.anz.anzpacific
gp:AOqpTOH_wBtolK1ZG0p-GatnAuO78s6oFcQa0FKSBb8Rat9mSyAOmiq2Ac_O0lZMK4VoDeM7veWdo5ypuSmhqg,Sandra Tindal-Davies,https://play-lh.googleusercontent.com/a-/AOh14GgIwg46nZLW3nalFpgmgqxIr8HFher1Qdw5opXi,another app that doesn't open,1,2,2.0.1.0,2019-03-07 13:05:53,,,most_relevant,com.anz.anzpacific
gp:AOqpTOGm4UZX4tRrL-whAu3fziRwIfEd0p5Z_ycz_fGkm9vv5LX8VYDHCv2MBZLAdyNpE58pGL4Ce-bbnA5uqg,Helen Oliver,https://play-lh.googleusercontent.com/a/AATXAJxzfHSwAdYnADwCoLV_TN9ShdfaKG1pGMcdzt4=mo,wont open. still wont open,1,2,2.0.1.0,2019-05-08 11:06:33,,,most_relevant,com.anz.anzpacific
gp:AOqpTOFztkbvRqIyqbn50c3_X7hgC9-nuiOCefdZ65b1n9qC9iCwwYZDj29BNGOo9S7BzbZWw28aGDUFYA_e3g,Deepika Ram,https://play-lh.googleusercontent.com/a-/AOh14GhG-ohbKIh7Il1D1NwikE_dU_DAWa_lfFfN0jCGUA,Why am I not able to download this app???,1,0,,2020-09-26 06:36:16,,,most_relevant,com.anz.anzpacific
gp:AOqpTOFmZ5mATX6g3WCYYi4DixADEnN8qp2wwDB9yVZwdoTwUG8naVyVIY7sRw-gXzHhlULoEwCC2LEER3knUA,Elijah Titan titan,https://play-lh.googleusercontent.com/a/AATXAJyec1YtXcAbAz5SiuxVoP1Br9npUMSzbY15Da1p=mo,App keeps failing,1,0,2.1.1.0,2020-02-15 20:41:39,"Hi Elijah,

Sorry to hear your having problems with our App. 

Please call our Contact Centre on +679 331 6644 so our team can help you with this.

Vinaka,
TM",2020-03-27 09:05:21,most_relevant,com.anz.anzpacific
gp:AOqpTOElDZgGnwQEupfD3VrMcL1NgTn__hpKZada-PUUC_DZE-pWafIMX6m_3m5tctSWrpXLWdWoDpxnw4m_RQ,Geoff Densem,https://play-lh.googleusercontent.com/a/AATXAJyCidaIns4b6n8ED0cdQOtc8bJE-gFH4eHyJUJf=mo,Pity in does not work in NZ.,1,0,,2020-12-25 06:23:33,,,most_relevant,com.anz.anzpacific
gp:AOqpTOFmRxb0Fi4zCsJUBxII8wn91r83FTGg-JIMsMdf9EQLE5bEmMHUsbszhcTj9vXdDTb4wcJzLzG9aMurGA,A Google user,https://play-lh.googleusercontent.com/EGemoI2NTXmTsBVtJqk8jxF9rh8ApRWfsIMQSt2uE4OcpQqbFu7f7NbTK05lx80nuSijCz7sc3a277R67g,I have downloaded the app but i cant open it.,1,4,2.0.1.0,2019-03-29 11:37:41,,,most_relevant,com.anz.anzpacific
gp:AOqpTOFNu9hVfU-Q2WtQjVQ5jvD0w6n19UmnjUdjXMMTq4G8rmmqNX_9ylSTHRWDRKxlb2HVbBwMgqbYXqHi-A,Gazzar,https://play-lh.googleusercontent.com/a/AATXAJzjM4KMLdKTt46eeE7Wfug6GMofEK7B0_hRudsW=mo,Can't open app,1,0,2.1.2.0,2020-07-01 06:22:00,"Hi Gazzar,

Please note the minimum Android Operating System required for our App is an Android 5.0. 
You will need a device at that level or higher to access the App. 

Hope that clarifies your issue.

Thanks,
TM",2020-07-27 11:41:55,most_relevant,com.anz.anzpacific
gp:AOqpTOGn6B1zXEiaY-LuYSE9N-c5EYK1zHVNn_4hsOD1bAnll36oyNHuRQ8qnde94yKxNiUJDVK-sbWv6vWbpw,Jnr Wale,https://play-lh.googleusercontent.com/a/AATXAJzI2hMZuZvdA9JTkBkwErlfwQjfa1_kVJJ_ikTt8g=mo,I can't install this app. What is wrong,1,0,2.0.1.0,2020-04-02 04:42:29,"Hi Jnr Wale, 

Sorry to hear you're having issues logging in to our App. Please update the App to the latest version 2.1.2 on your Playstore. 
Feel free to call our Contact Centre on +679 331 6644 if the problem persists. 

Thanks,
TM",2020-04-21 03:24:05,most_relevant,com.anz.anzpacific
gp:AOqpTOFLIMCaOUZ_eTBYu9K6OlD0hy5VpgJAT4ps8kCi9hpjobkm3GX_8ApAzHRWJKZA5xIY86lN-oswb9yiZw,Wendy Shortley,https://play-lh.googleusercontent.com/a/AATXAJzfJq8DMb7Zf2mredQd5jjY9W65ZHVMMrQksxK6=mo,just too hard,1,1,2.1.2.0,2021-03-28 16:20:29,,,most_relevant,com.anz.anzpacific
gp:AOqpTOGkfpnfNjBIcnvpzuUkNXOgIMcRY0jy3Zog3nO2ZrY5hc5fNyBecHCGjQmxka6BiwG80DodQu_iS2L2OA,Berry Johnson,https://play-lh.googleusercontent.com/a/AATXAJzhYQef--K1-2sXbiH5Ni79RoEwtf2e7MPVZkzb=mo,Does not open,1,0,2.1.2.0,2020-11-15 17:23:18,,,most_relevant,com.anz.anzpacific
gp:AOqpTOH-yW1fP43ckotoGN4qXENGBOpuYABkEyj_f7cROMkK0urLB-Y_1CcchcbSsgsQUL1YSgSSFoiUF6aq_A,Avinesh Chand,https://play-lh.googleusercontent.com/a/AATXAJwjSICwetPXbZ1dRh3Ua_0zVDS7oDXp1c3Muacz=mo,Everytime out of service,1,1,2.1.0.0,2019-09-18 09:46:25,,,most_relevant,com.anz.anzpacific
gp:AOqpTOG0gEMMXf_jSvF_zTl1ys643X8atXN_dwksQET4n3bmDXbS1HFxNswPuOSCRjrx_uzqF151bNsccRsnCw,Torika Radinitobakeisuva,https://play-lh.googleusercontent.com/a/AATXAJxt10FwbeuCOtXTXGgXyTHewAF44e7T1fC7W7n5=mo,My this app can't even open so how am I gonna use it???,1,0,2.1.2.0,2020-10-23 05:30:52,,,most_relevant,com.anz.anzpacific
gp:AOqpTOEWxrs57Ak6-Ukb6_5toDZyuhMgc-GcxewfbjLYd_04AtDB1HDyd8verbArFPQ4PBGLiRJrLTTKzY2bMQ,Joanna Masirewa,https://play-lh.googleusercontent.com/a/AATXAJyGaAwK_XqxslblpkLlg9EVQ5KO9dfv8bdKdUJo=mo,Not user friendly,1,0,2.1.1.0,2020-01-03 14:59:49,,,most_relevant,com.anz.anzpacific
gp:AOqpTOGqw3J4dGnycsqAzoK8L6aHUYnWO0p_WACbEZpJDVJYsIdvBFMU9CoLPJtJ-TIcNv7D3oFrf5PwCAZ--Q,A Google user,https://play-lh.googleusercontent.com/EGemoI2NTXmTsBVtJqk8jxF9rh8ApRWfsIMQSt2uE4OcpQqbFu7f7NbTK05lx80nuSijCz7sc3a277R67g,very bad not good,1,2,2.0.1.0,2019-02-25 15:59:51,,,most_relevant,com.anz.anzpacific
gp:AOqpTOFltlouqpOZoMzuPJua0Vx6-iUkiJmA976-3p1RUaI5ANTzCpj21uPRhjf-j6wmtAFl0vJB-t5TpiRSLA,Lauro Lazzara,https://play-lh.googleusercontent.com/a/AATXAJzIkMcZwXjyKahRWg9GgaC30-mJ_OwtG__ZXj_a=mo,confused wheres anz app?,1,1,,2019-04-14 05:42:42,,,most_relevant,com.anz.anzpacific
gp:AOqpTOG36PJgFVK7Bza75QIAhf3xIhMHsDDelHrAomjNKC4IyjES25zyK4ICIOIZNRRbMLP7UsaMyolK2-YG4Q,Diaz Qomate,https://play-lh.googleusercontent.com/a-/AOh14Gi_881QRaMHTgbxIMW0BH5zYD_J__d43AKx9oEL3w,Useless,1,0,2.1.2.0,2021-01-28 09:21:49,,,most_relevant,com.anz.anzpacific
gp:AOqpTOEKvMCS2_iSm7RDhF6L88Yrqv1NfK2YFzgYSZuTfISk2qe9oJ3wNPReS-dT6NLPCw9X_51OJ9jiY_vLCQ,Bryn Solly,https://play-lh.googleusercontent.com/a/AATXAJyikjikcY7S1TFCeZpRQrwhzrHeIRUSDiy-4a0Y=mo,Poor,1,0,2.1.1.0,2020-01-25 04:20:07,"Hi Bryn,

Thank you for your feedback.

Recommend you update the App to the latest version 2.1.2 on your Playstore. 

Please also feel free to call our Contact Centre on +679 331 6644 if your problem persists.

Thanks,
TM",2020-03-27 09:38:35,most_relevant,com.anz.anzpacific
gp:AOqpTOEyzQIq3Unt1UOKObdRjvSlfkiGaPU1CeDoYZJ6pBnn6g-sIRXWKbIRoyt-9tynm1GTD7hZBKh-9LTQWA,Karthik Vazeer,https://play-lh.googleusercontent.com/a-/AOh14GjX0XqXpxncl4LeTSwOQh3rKgX6ZHWMJPDnC8eL,😍,1,0,2.1.1.0,2020-01-29 07:31:24,"Hi Karthik,

Please feel free to call our Contact Centre on +679 331 6644 if you are facing any issues.

Thanks,
TM",2020-03-27 09:34:31,most_relevant,com.anz.anzpacific
gp:AOqpTOHUK5_QGdH2_ILTsCFrGIHYXnG6zqWEziwa6KFRh-X_meZRFclXwKJqD3LJXy494tW1nUuHWJ2D4Y89gA,Shuiab Hakim,https://play-lh.googleusercontent.com/a-/AOh14GgrHvGrZmgvbWujgQx5v3wRJZdXj_TxM9yS-Jfh-g,Was all good before. But the App doesn't open now,1,1,2.0.1.0,2019-04-10 14:51:32,,,most_relevant,com.anz.anzpacific
gp:AOqpTOFR5Ns3xukU9kVz5GwZpvPceH7J6ARK7wq5GDFU_7w3hXMTOfU5LD6kFyyFishEz3wDoWfLj1EYPWBUoQ,arif sheik,https://play-lh.googleusercontent.com/a/AATXAJwmVqY9kljEa9CL5fPJGbdWOxopZ77tAppgdy2e=mo,very slow,1,0,2.0.1.0,2019-12-10 11:52:42,,,most_relevant,com.anz.anzpacific
gp:AOqpTOG4rQIDdZYEqjC7dqqfGOFkKgy9Y_wnwGs9B0MSCDR9qmror5tsmNT0dXDfEoWg2LYQrv6CFvPR7En-Ow,Canisius Tabutoa,https://play-lh.googleusercontent.com/a-/AOh14Ggs6Gg7o8YT0_S2HCMuoHoR3A_l5X7IDfUY-TuOLQ0,"Always crashing also really really slow to log into. ****Terrible still 
haven't fixed the app crashing!!! (updated 19-4-18)",1,14,1.0.2.0,2018-04-19 17:56:50,,,most_relevant,com.anz.anzpacific
gp:AOqpTOEskchHU9gXDgmIWjbxDaahvMYIjJbBXO1XWzs9SOn4JcWuj3yE3UVfAAXyg-KEAqJztyniNxicishcOg,A Google user,https://play-lh.googleusercontent.com/EGemoI2NTXmTsBVtJqk8jxF9rh8ApRWfsIMQSt2uE4OcpQqbFu7f7NbTK05lx80nuSijCz7sc3a277R67g,"Every time I try to open the app there is a message saying its unavailable, try again later. Completely useless!",1,1,1.0.2.0,2018-09-03 04:41:56,,,most_relevant,com.anz.anzpacific
gp:AOqpTOHFwSG9kJN7nrPM3W4v8Gd8eL9QKEDA0CrWF_h_jy_lBGLVRiQmEycq-VT2C-dpK3BWdtfsZnH8GJLJzA,Chandni Singh,https://play-lh.googleusercontent.com/a-/AOh14GisufscXr42MU2DbAcmWm8hnX9ougugVrvwa8ThjQ,It's really slow n freezes alot.,1,4,1.0.2.0,2018-04-04 07:20:07,,,most_relevant,com.anz.anzpacific
gp:AOqpTOGppoIaA6wzF-Vf-DZQVETdaa34l5rFRYNxYMe6-8wJ5mZ3PC-kUV18QdRWWlY3EZ5HhM_V_13OAGdsYw,naathan clark,https://play-lh.googleusercontent.com/a-/AOh14Ghwnh_AdutxLhOXXTAlaqEdqEkzA4RxsUiADV0Aew,"Unavailable , I rely on phone banking and was having no problems until you forced me to download this app",1,0,1.0.2.0,2018-09-07 09:16:27,,,most_relevant,com.anz.anzpacific
gp:AOqpTOHJ49Z63fmyvlrMDMIMZeqvCyQG22pF1mzG_MAljgDwgWjN3BU9z0mHFYRIPMZTk-wNjHGTsoepc5IX7g,A Google user,https://play-lh.googleusercontent.com/EGemoI2NTXmTsBVtJqk8jxF9rh8ApRWfsIMQSt2uE4OcpQqbFu7f7NbTK05lx80nuSijCz7sc3a277R67g,Program ur app nicely,1,1,1.0.2.0,2018-08-31 09:27:00,,,most_relevant,com.anz.anzpacific
gp:AOqpTOFMcGCCEXdh4zb-V_ZcxIkf0SrWEBpto_-g5HzijQFXuaELSyKXeQ-gsW1vYX1eSOdiX01eXJxnThrhYA,A Google user,https://play-lh.googleusercontent.com/EGemoI2NTXmTsBVtJqk8jxF9rh8ApRWfsIMQSt2uE4OcpQqbFu7f7NbTK05lx80nuSijCz7sc3a277R67g,"Nice initiative but app didn't work on my Samsung S8. Very slow to open the app and display a white screen. What's wrong, ANZ? I thought ANZ  had the best guys in IT to develop an app of this magnitude. Please do something",1,1,1.0.0.0,2018-02-06 05:44:42,,,most_relevant,com.anz.anzpacific
gp:AOqpTOFjyohQElEo5PIvggFbFeAQFjj53X1KUReDijRjYrWkuf-ieJ4v6FnZGCuGLSoLtCPjkXSDNgAprWHjIQ,Watisoni Kaumaitotoya,https://play-lh.googleusercontent.com/a-/AOh14GglxEXQfPNTXbzcplBi6X1-MoacAaZ_fLj9owf8qQ,"I was delighted to find this app available for Fiji Users   However, I was only able to use it once. Since then, SCREEN freezes on what's page. Hope the developers fix it soon.",1,2,1.0.0.0,2018-01-12 09:31:14,,,most_relevant,com.anz.anzpacific
