reviewId,userName,userImage,content,score,thumbsUpCount,reviewCreatedVersion,at,replyContent,repliedAt,sortOrder,appId
gp:AOqpTOGewoyd4duI-2V3M8XJbyZ1FVCl-nPtLfNEZfXjKHzGS-bjF_d9b1plRaqLpx2-jtke4Bhk6ljGAWt6uO4,Mik Scheper,https://play-lh.googleusercontent.com/a-/AOh14Gj5cuWTmCTX55G5V0-ElXmsKLIOPPWQOH9D1dGj4jM,"Tried the app for the first time in years. It asks for my PIN, which is fine, except my ANZ PIN has more than four digits, and it only lets me enter four. Then it chides me for getting it wrong. Somebody really didn't think this trough. I might call Australia to see if it can be sorted, but it seems unlikely.",1,1,4.21.0.0035,2019-12-29 04:59:55,"Hi Mik, Sorry to hear you're having trouble with the update. Can you please send through your mobile number and any other information to mobile@anz.com and I will look into this for you? Regards, Mobile Banking - Jessica",2016-02-26 04:24:57,most_relevant,com.anz.android.gomoney
gp:AOqpTOGRT_rWDrxvGoN6jjHgHCze4DApekJ-ivt9-fJMq-01ID7RbUzXqYnHystGhaG5Ya9GVfrLhr3obbUIr3A,J Pratt,https://play-lh.googleusercontent.com/a-/AOh14GgqKfp96ymawRqfzsZuLzoWM-PETTkZ4SChZfgaZg,Can't save contacts/payment information on Nexus 6P and automatically logs out wayyy too much. Also doesn't support multitasking (not because it can't but because for some reason it doesn't trust you if you are) and also requires that I disable my night mode app to use it.,1,2,3.0.1,2016-06-10 18:49:16,,,most_relevant,com.anz.android.gomoney
gp:AOqpTOE6DZPwKUg3q6mRaVGpi1ENcIVJpjoVnP9CGedxKv6I9qm_EVOBv36V7VtjXRiGFUm8taGH3n8kBCSx408,Susi Rose,https://play-lh.googleusercontent.com/a/AATXAJysiGfXTUGRqiGY1Sjl5GLeAQIK3s38H4njVFnn=mo,"Downloaded this app put in c r n and password, but can't log into the account as the register button has the information button over lapping it. Now every time I try to press register to log into my account, I always get the info of where to get your c r n and password! What good is this app if I can't even log into it? Please fix this asap.",1,1,2.1.0,2013-09-08 00:03:00,"Hi Susi, Sorry to hear you're having trouble with ANZ goMoney. Can you please send me your mobile number and device details to mobile@anz.com and I'll work on getting this resolved for you? Regards, Mobile Banking - Darien",2013-09-09 04:32:48,most_relevant,com.anz.android.gomoney
lg:AOqpTOE0CsVuo2fuIqq61Tc-d4hTQWPru0HV4tx0ig9hx2ZzqQoaEOrz4O6h3zSQIzLAJNGsAVAODozqfRBYuMo,A Google user,https://play-lh.googleusercontent.com/EGemoI2NTXmTsBVtJqk8jxF9rh8ApRWfsIMQSt2uE4OcpQqbFu7f7NbTK05lx80nuSijCz7sc3a277R67g,"Tried to pay someone, app is limited to $1000, but if I use browser, no such limit, what a joke. Apparently this app is only secure to a $1000, but, browser is more secure, so what's the purpose of an app? G for garbage. What don't you have a pop up giving reason/limitation, tried to do something else the other day, also was not allowed to do. What a joke, browser access is apparently more secure, and has no such restrictions, back to browser.",1,0,2.1.0,2014-06-15 18:47:36,"Hello, Sorry to hear you're having trouble with ANZ goMoney. Can you please send your mobile number, the name of the device that is unsupported and any further details around the issue to mobile@anz.com and I'll look into this for you. Thanks, Amanda",2013-11-20 05:44:51,most_relevant,com.anz.android.gomoney
gp:AOqpTOHn0aEdmd4a5pwNUHjLwMFYAFnrmlVfAzCJOeAR4nN3vDFCdjM6z-WLc3wHljtkcXrHH6aGBNXRw2OhyBo,Aazim Ibrahim,https://play-lh.googleusercontent.com/a-/AOh14GgXUcsaWIs8LM6TbmL898cbY6FyJ9OrLVYIDTEK,Does not work when I want it to. Keeps saying service interrupted. Give a proper error if its down for maintenance rather than cryptic messages that dont explain the actual issue.,1,0,2.1.0,2014-01-18 21:15:32,"Hi Aazim, Sorry to hear you're having trouble with ANZ goMoney. Can you please send your mobile number and any further details around the issue to mobile@anz.com and I'll work on getting this resolved for you. Regards, Mobile Banking - Amanda",2014-01-20 08:45:55,most_relevant,com.anz.android.gomoney
gp:AOqpTOFotRlVggPbzi9CBxE-1WgBfcCqY73wdRhkFvgZ2zXNd6DjTiqEbGxHDQl-oSTGomcIHrgBsNKIoNG3yLk,Trisha Roche,https://play-lh.googleusercontent.com/a/AATXAJyc6o6X01zdMsr-rrRGjy3RZPCo2r9ZS7P6-N_g=mo,"Way behind the Westpac app.  Money spent on debit or credit card takes days to appear.   No live data! With Westpac I can pay, go outside the shop and see the remaining balance live!  I don't use paypass as that takes even longer! Even payments between accounts - can show the deposit from one account and not the withdrawal from the other?!?",1,28,2.1.0,2014-12-17 21:04:37,,,most_relevant,com.anz.android.gomoney
gp:AOqpTOELd5riZn4kPlEk98vba3SX_4hGobtc0JyxOS-Cv4U0Un_d5OblVYPoex_ELGrrX4WCagEhfYCJBXlF0LI,Michael Visser,https://play-lh.googleusercontent.com/a-/AOh14GiwmWDgbe7848ZPSCCCxXhvfDzT1aunPm93Y1JhLA,"I can sign up for a bank account with a phone number and yet can't use GoMoney without an active Australian mobile number, stupid requirement affecting expats.",1,0,2.1.0,2014-11-02 06:42:06,,,most_relevant,com.anz.android.gomoney
gp:AOqpTOHn8eKlm8H7JyZRmicxfXjklK7FkGNtod7nZ5eWCifM-k1BH8hkHZCPZKBH1SC6c41vc6ZAYE9QIotdDTo,Nicholas King,https://play-lh.googleusercontent.com/a-/AOh14GiCj_74FeFjVM7eHR3hi59HkcnccK4nfBfdxVBktQ,Sat in anz branch as per -usual staff are not up to date with their companies mobile delivery Bounced between 3 people and three phone calls to the anz god...then handballed some pathetic excuse for reasons why the pin number remained unchanged after a reset 3 times....and then they asked me why I changed to Nab ...go figure.,1,0,2.1.0,2013-06-04 08:40:40,"Hi Nicholas

Sorry to hear that you did not have a great experience.
Can you please send an email to mobile@anz.com with your mobile number and I will be able to help you with the PIN issues.

Cheers Ash ",2013-06-04 09:13:09,most_relevant,com.anz.android.gomoney
gp:AOqpTOHFpXxZ3R3gbBmmz641lN_j9oSf3oO3OniwCRXU62wkGS6df2mZwHyW-TZOtvJhRzRTgqcNlFpEc2W8aAo,Joe Jongue,https://play-lh.googleusercontent.com/a-/AOh14GhilOuyg70G_BZtSS0isNdH0BDhP7nSOHcAABHQ4yE,Stopped working all of a sudden. Force closes. Also fix or replace that atm at Southgate.,1,0,2.1.0,2013-06-13 02:50:19,"Hi Joe,
We are aware of the issues with goMoney for Android. It is under investigation and should be resolved shortly. In the interim please use www.anz.com/mobilelanding for banking on your mobile. Apologies for any inconvenience caused. Regards, Mobile Banking - Ash",2013-06-13 05:54:47,most_relevant,com.anz.android.gomoney
gp:AOqpTOFcTArkOIqcS2i2zj4eAc5KLb6Aw3X8JPZVQNDZkLgzMvrhf5mktBybMzHnGNx0ySuKbHnoog910qecR4I,Alys Lizza,https://play-lh.googleusercontent.com/a/AATXAJyiXJX2-6dkrUhJOqV1owJPbmhWfZqKeCJgO2AM=mo,Crashes immediately won't load my registration.. S#*T,1,0,2.1.0,2014-05-19 03:33:04,"Hi Alys, Sorry to hear you were having issues with goMoney. Is it up and running for you now? If you are continuing to have difficulties please email mobile@anz.com with your mobile number and device and we will look into it for you. Mobile Banking - Amanda",2014-05-21 19:23:38,most_relevant,com.anz.android.gomoney
gp:AOqpTOHmFTL9-NQxPdf48JD0vVAcBueIxYWGzCb1Cii1fwiFmdGTP4TIegHIjLCInY_oW8Edfs8Pmos2LvVHcKA,Curtis Seguin,https://play-lh.googleusercontent.com/a/AATXAJyqSQs-FltMjxuSMjKhSnA_A9n9dZLMAWIG94x-=mo,What are developer settings that I need to turn off. I can't  Open the app because of this message. Have tried uninstall and reinstall. No luck.,1,0,2.1.0,2014-01-23 14:32:49,"Hi Curtis, Sorry to hear you're having trouble with ANZ goMoney. Can you please send your mobile number and any further details around the issue to mobile@anz.com and I'll work on getting this resolved for you. Regards, Mobile Banking - Amanda",2014-01-20 08:46:13,most_relevant,com.anz.android.gomoney
gp:AOqpTOEb0MoHUCY-GO6Fn3Qom2FlZ6bzTWYrk8zDuIqrVIlhB0evc8j5c5ISY-zSlCD0C1KNtGSAC_mYcxH5WSg,Yasir Farabi,https://play-lh.googleusercontent.com/a-/AOh14Gi-buUvlRrDfCVTkA2UgpTM-z95zyqkouB0JuykCoU,Can't use the app because the activation SMS has never been delivered to my phone.,1,0,2.1.0,2014-11-28 08:07:38,"Hi Yasir, Sorry to hear you are having trouble with goMoney. Can you please send through your mobile number to mobile@anz.com and I will look into this for you? Regards, Mobile Banking - Jessica",2014-12-03 05:26:04,most_relevant,com.anz.android.gomoney
gp:AOqpTOE_z1gU3k0k4-Dd3VcxTqdIjVQTLfpj6Q4ui_3HBFBBQS1NWVHWwjwE6UgUgBIrwxwFj0Qk01ulIlGbFDM,Kenneth Luke,https://play-lh.googleusercontent.com/a-/AOh14Gis6lGdrcrhvKPuL9X2gWx-dwJNVuCfsPPTUilC9Q,Can ANZ make this app available to the users in Papua New Guinea???,1,0,2.1.0,2013-11-08 02:25:15,,,most_relevant,com.anz.android.gomoney
gp:AOqpTOGxd9YbO74LcWrFZSjE9esUln5CaME6U8OPAbc7TEU4R7KprnrJJNmJdyyesXIFHpD785qz4GU3S5mfb2I,Prayash Pradhan,https://play-lh.googleusercontent.com/a/AATXAJxp8-1r-pR5MmfnrUhjq__l4DiFoebZkPRkpGc=mo,Too basic in this competitive time.,1,0,2.1.0,2015-01-04 07:05:12,,,most_relevant,com.anz.android.gomoney
lg:AOqpTOEKvvKtWjKEnJdoX-mLhiJ5WdEMqPzE3FnOdiruWcq5aOpbWacLSyC-rrf0hAWFeTjb_mc1QKZCGAdwTfo,A Google user,https://play-lh.googleusercontent.com/EGemoI2NTXmTsBVtJqk8jxF9rh8ApRWfsIMQSt2uE4OcpQqbFu7f7NbTK05lx80nuSijCz7sc3a277R67g,Won't allow me to log into my ANZ account that I can access via the internet using a normal pc web browser so for this nexus 7 user its useless,1,0,2.0.0,2012-11-09 16:33:57,,,most_relevant,com.anz.android.gomoney
lg:AOqpTOG3xvzB-oXhE_x6AaO0SaLNs5es6IQE-t524G1rDKEBmNnKpUZqA_QexrIZHlnFhXycYBDW02vriI7g1pc,A Google user,https://play-lh.googleusercontent.com/EGemoI2NTXmTsBVtJqk8jxF9rh8ApRWfsIMQSt2uE4OcpQqbFu7f7NbTK05lx80nuSijCz7sc3a277R67g,Works great on samgung galaxy phone. Doesnt work at all on the samsung galaxy tablet,1,0,2.0.0,2012-10-13 07:53:28,"Hey, the latest update of ANZ goMoney is tablet friendly. Download the update on your Android tablet and give it a go. Let me know if you have any questions, our email is mobile@anz.com. Thanks ^Leon",2013-03-28 07:13:55,most_relevant,com.anz.android.gomoney
lg:AOqpTOH-hkst8hf0lTXSLgCTLz4piJUIMk4k0zvMcwZj1cQ9Zr50edp_9vNEKggiU9KyCOVdM1FnplIQwOd6EKc,A Google user,https://play-lh.googleusercontent.com/EGemoI2NTXmTsBVtJqk8jxF9rh8ApRWfsIMQSt2uE4OcpQqbFu7f7NbTK05lx80nuSijCz7sc3a277R67g,Does not work at all on tablet. Installed & uninstalling twice & still nothing. Just comes up with service untrusted. Not happy.,1,0,2.0.0,2012-09-07 06:22:39,,,most_relevant,com.anz.android.gomoney
lg:AOqpTOFRLNrZ5M2-4KvqQg8gHV-BfiOPUzmU3jtH0P0S17sfi8qIE74E-KW2_jF8YHrTNvZFBnLufgle4JTOPhg,A Google user,https://play-lh.googleusercontent.com/EGemoI2NTXmTsBVtJqk8jxF9rh8ApRWfsIMQSt2uE4OcpQqbFu7f7NbTK05lx80nuSijCz7sc3a277R67g,"App just comes with this error all the time, and r u listening to any complaints?",1,0,2.0.0,2012-10-01 15:10:16,,,most_relevant,com.anz.android.gomoney
lg:AOqpTOFI6zzKI4fNlvoiQJf-uv7KUtDYg4KwyxTOjJQcb2gCAnlNSmIyj1KX7dAIMgHUj0k4xeUIIl8GHfzPTac,A Google user,https://play-lh.googleusercontent.com/EGemoI2NTXmTsBVtJqk8jxF9rh8ApRWfsIMQSt2uE4OcpQqbFu7f7NbTK05lx80nuSijCz7sc3a277R67g,Works on samsung 8.9 tablet. Htc sensation but not on this,1,0,2.0.0,2012-11-01 16:24:58,,,most_relevant,com.anz.android.gomoney
lg:AOqpTOGlwWcVEMygK7jWNYeoRe9cSGVu4PTiIu90v0MSGyWOQwUZbHYURSlFJda4ZEZaknA5F3FoWt8Tauhc5bc,A Google user,https://play-lh.googleusercontent.com/EGemoI2NTXmTsBVtJqk8jxF9rh8ApRWfsIMQSt2uE4OcpQqbFu7f7NbTK05lx80nuSijCz7sc3a277R67g,Works great on my Galaxy S. Worked a few times on the Nexus 7 but then wouldn't let me type in the PIN code. Uninstalled and reinstalled and now can't enter the CRN. Please fix.,1,0,2.0.0,2012-09-22 11:18:12,"Hey there, our latest update provides further support to Android tablets. Download the update and let me know how it goes for you. Cheers ^Leon",2013-03-28 09:35:05,most_relevant,com.anz.android.gomoney
lg:AOqpTOEmj7nWGL3Sc7sCi0Vlf5lc_-FsA490N7qn74N-7rrmFG2-0zNijvHWPN9SWI4ECIbQqB_dgcUcdYA0uS4,A Google user,https://play-lh.googleusercontent.com/EGemoI2NTXmTsBVtJqk8jxF9rh8ApRWfsIMQSt2uE4OcpQqbFu7f7NbTK05lx80nuSijCz7sc3a277R67g,Always says u have exceeded daily limit even when u have not done any transfer,1,0,2.0.0,2012-11-16 17:48:24,,,most_relevant,com.anz.android.gomoney
lg:AOqpTOEZwnQLAWdfKc58E9hewKI3JsnPG9ckvLWiDp5lIkbvACe-VsDHXmKgW34GRMb7WIpr5tgX6JtnTGIILPU,A Google user,https://play-lh.googleusercontent.com/EGemoI2NTXmTsBVtJqk8jxF9rh8ApRWfsIMQSt2uE4OcpQqbFu7f7NbTK05lx80nuSijCz7sc3a277R67g,Nice idea. Needs functionality for android phones with smaller screens.,1,0,2.0.0,2012-11-12 16:23:49,"Hey Matt, we have fixed the small phone compatibility issue with our latest update. If you haven't done so already, download the update and see how it works for you. If you have any other questions, shoot me an email at mobile@anz.com. Thanks ^Leon",2013-03-28 06:57:55,most_relevant,com.anz.android.gomoney
gp:AOqpTOEWrkZ23iXeXYJ1PrswIX-fbeYLUrvkgOExvdPY4FTLL6_Fq97CymQJ4_n5jXRwSAeOVQ7liBF64eydTyc,Joy Toy,https://play-lh.googleusercontent.com/a-/AOh14GjIgnbjZiMbInTbDtdkqqXeaOEyNw0zYoI2_H-g,"Won't let me log in. Un-installed! The other one says my phone wasn't set to the right time. Ditched that one too. Stuck with the old one, at least it works...",1,0,,2012-12-17 14:11:18,,,most_relevant,com.anz.android.gomoney
lg:AOqpTOEXK2BW1chkWiu3BvjHlLaa_vd__DGfafz4titc1Q8Ed0P9cBtW13M12AmqdLzjAMpBLGojVM5tJVYahFg,A Google user,https://play-lh.googleusercontent.com/EGemoI2NTXmTsBVtJqk8jxF9rh8ApRWfsIMQSt2uE4OcpQqbFu7f7NbTK05lx80nuSijCz7sc3a277R67g,"Working really good on my Samsung galxys2,but not working at all on my Acer tab a501.so finally they made something good which doesn""t work properly.",1,0,,2012-09-22 08:03:03,"Hey, have you had a chance to download the updated version of ANZ goMoney? It provides support for Android tablets. Download the update and let me know how it goes. Thanks ^Leon",2013-03-28 09:50:22,most_relevant,com.anz.android.gomoney
lg:AOqpTOFaZC9_PmVUBlndIsYIrM0ntRFlNFtbyVba_I_ahBCJe1kVQu5-vshrAlNQSUmHFJIG0YS15mGwrX2CO34,A Google user,https://play-lh.googleusercontent.com/EGemoI2NTXmTsBVtJqk8jxF9rh8ApRWfsIMQSt2uE4OcpQqbFu7f7NbTK05lx80nuSijCz7sc3a277R67g,This app works the first you install app and when ever it wants to. I can log in but it does not display any of my acconts . I have 4 accounts attached and nothing comes. Neee to fix the bug.  Ta,1,0,,2012-11-05 06:18:17,"Hey, we're aware of this issue and have a fix for it. Can you please to go to Settings, Developer Options, Don't keep activities and ensure that this is unchecked - you should now see all of your accounts! Let us know if that works for you. Thanks, Mobile Banking Team
",2013-01-16 06:13:51,most_relevant,com.anz.android.gomoney
lg:AOqpTOFpez3Wx1ivhKUvQOZok7nJD-jW6kYXJsAwdSa89sFkMyFKaOaH0AZ48-IFv6NFqEZp7psXTxpTm1j33z4,A Google user,https://play-lh.googleusercontent.com/EGemoI2NTXmTsBVtJqk8jxF9rh8ApRWfsIMQSt2uE4OcpQqbFu7f7NbTK05lx80nuSijCz7sc3a277R67g,very poor app too bad android :( iphone version is much faster very fast on my iphone 5 :]],1,0,,2012-09-29 20:42:48,,,most_relevant,com.anz.android.gomoney
gp:AOqpTOEtDm8D_CoBajgohlr8oR6360rUQidrA4ns130j5HlkfiwsW2kw3TJ4tZBKRChjHF4fuLEaHTJN_FLPwqQ,Alan Lukic,https://play-lh.googleusercontent.com/a-/AOh14GgV8imkUmcfOtmjNiAx3Md2jAoMx3JqiD0tl8yRSQ,Cant copy and paste username,1,0,,2014-08-14 14:47:01,,,most_relevant,com.anz.android.gomoney
gp:AOqpTOHxW-wRwZwFTv6By2xujgu_SpqBicyphD_UMZIGfkmmLq3uZms3Us41uXilePpTUCUEgx0fy5ZLnUaRNF8,John charitos,https://play-lh.googleusercontent.com/a-/AOh14GjiDc8Ji8d2adYROVj7WIAH0rjEr6rGW54Kh-eSJA,Cbb salary sacrifice needs to be supported to check on the go,1,0,,2013-04-09 23:17:24,,,most_relevant,com.anz.android.gomoney
gp:AOqpTOHp_pycIs-vP9TOdLTy-PhRRCAYx9I-cTy-cRBB8LTdBVhcVFp7zVdGeuN5lDFmq4-R-9zOTDE5FjwpUrk,Ole Taemtan,https://play-lh.googleusercontent.com/a/AATXAJx5bcaJT6Yd1bcop6IYC8XUO8NHfw2WAZz9uZtr=mo,It won't download,1,0,4.33.0.0139,2021-06-28 15:08:00,,,newest,com.anz.android.gomoney
gp:AOqpTOEq4keR_JslQZNZNQxuFL6d-oLY41_SO2OwlZzgXzUSfLOSVNb2G8oHG-T9qo5Sy6kvoSvfIGlgsOUkGKw,Chris casey,https://play-lh.googleusercontent.com/a/AATXAJx1ZdAiG79LLLlS5lJHVAgrX6-3raIk8-I6v57J=mo,It is Pisssing me Off upDateing the App 2 to 4 times A Year Again and Again No Choice ?~ Again Liveing and Workin on A Farm with no Wifi +A Very Weak Phone Signil Havein To Up Date Sumthing That Has No Problems JUST SO YOU CAN SEE WEAR I SPEND MY MONEY I WILL CHANGE BANKS BECAUSE OF TOO MENY UPDATES,1,0,4.33.0.0139,2021-06-28 11:31:34,,,newest,com.anz.android.gomoney
gp:AOqpTOHVHy67L-rj7XS1wvcYEW3jwK_hZpNRbFQ1OWrfSqwZL640y8vcEs4beMEVRLmaTj8ZtC-sYGj9EhrcUaQ,Cory Connell,https://play-lh.googleusercontent.com/a/AATXAJwBF52Hpy-3qD1jyYXvz7flSMlUO7_d726zsnpl=mo,Take away distracting messages asking for a rating during transactions,1,0,4.35.0.0145,2021-06-28 02:47:30,,,newest,com.anz.android.gomoney
gp:AOqpTOGRWz5nHBpoqNmSo76vpaBE13Pg1rOXMa-XwRhMn2Bjd-61pvtXbqBMR4OOwQBJb0c_kO3b3YjLEJQAfPg,Samson Vara,https://play-lh.googleusercontent.com/a/AATXAJxTg2exE38Jn9bVUJgQjqYGwdNDJ_HLjZD9a-9U=mo,"Why I am going to update this app every time when I want to use ,is it okay or some want to Huck my account",1,0,4.33.0.0139,2021-06-27 04:55:14,,,newest,com.anz.android.gomoney
gp:AOqpTOE07jsV7-aD2cxg_ZzOKzY0X_5FxTKW3lChLG1kpTR7rFcsszBCUJHSxWWkGGe4g4ChNieYeyEoyGSGSfE,Kareena Thompson,https://play-lh.googleusercontent.com/a/AATXAJz8X-vQ6n6nePMTjmzSCZhiDmRVZ_p3FJQCuZpP=mo,I have to delete other apps to update,1,0,,2021-06-26 23:13:35,,,newest,com.anz.android.gomoney
gp:AOqpTOEDi7jzmztAg8M15-I1odZuXp7CFm9BhXvn5J11nWH8d4hz9l2Wp9G2AeqHjTwr34WP9mUQS8Xd5jdzjvU,Sam Dobbin,https://play-lh.googleusercontent.com/a/AATXAJzALYtvrprnbRad-1-gmX5YOaJXPaoDZlbP0Ls=mo,Takes to bloody long leave things alone it was ok,1,0,4.33.0.0139,2021-06-26 14:30:09,,,newest,com.anz.android.gomoney
gp:AOqpTOGgF2Xo2_Iazey7qTFK39iHiJFnLc3ooi6htOTfgisrfmesegihqRgE5TTDsuxheAzkz51p9yIPu3UeeYg,David Kendall,https://play-lh.googleusercontent.com/a-/AOh14GjHS-L5gSPJYqk_XRy_R_8lX6amFqISi2egUOuQcQ,I can never view my account??,1,0,4.35.0.0145,2021-06-26 09:14:22,"Hi David, thanks for letting us know. That's not what we'd expect to happen so we'd like to investigate this further for you. Can you please email mobile@anz.com and kindly include your device type, operating system, ANZ App version steps the replicate the issue and screenshots of the issue? Thanks, Aly @ ANZ App",2021-06-28 10:13:30,newest,com.anz.android.gomoney
gp:AOqpTOGLndjAs6VaMSx4m7jLZ8JA94kbH-DJz29sz6XKCwGFHxaZ2FCYleMushLTDZ8bZ_xZqYPnXQSJAkJdWds,Neville Haskin,https://play-lh.googleusercontent.com/a/AATXAJw3aO-_Bd1AWfi8b58TCv_tAzupH5GsCaXqKdJ1=mo,Up The. S. T very bad service by Optus Extremely hard to use or get to my details,1,0,4.35.0.0145,2021-06-26 05:07:28,,,newest,com.anz.android.gomoney
gp:AOqpTOG8e7jdeWeSsfNEzewatN0UAxpbR1rOLzYcT1x7K87Lz8sgkWzIHLSrLv4APYphP_YKg3OIP7bmvoGlWLY,Paul Goode,https://play-lh.googleusercontent.com/a/AATXAJyH-FWlgHRcWf-ETFf98D-S8zJvSFZbrzoJ3qTz=mo,Good enough.,1,0,4.33.0.0139,2021-06-25 13:40:13,,,newest,com.anz.android.gomoney
gp:AOqpTOF32MC-RcyJRbHqIgAt_UCBE3nUzuv-ntwqOsoCemudiqwCPlwXGHogqW-xbzJ4Ha4qOhu6bD_eiQvKg8U,Edwin Graham-Vanderbyl,https://play-lh.googleusercontent.com/a-/AOh14GiPs0p9a4x7TGETgjb8kmL-1jczr6Geie_GYotpvA,No Good,1,0,4.33.0.0139,2021-06-25 12:08:33,,,newest,com.anz.android.gomoney
gp:AOqpTOHm4kAHJUWG6A3bKOk51c7yI0mt6gealZ2dvBR3PAbqHwSQvaa1Kui0cqhqEVgHsktIdhEapisXRiQUGEc,Aidan Mephan,https://play-lh.googleusercontent.com/a/AATXAJwBREpFstMN-lOicPJVQ-e-3OuOSKjCXxHqDpFL=mo,Forced updates. Uninstalled.,1,0,,2021-06-25 10:28:54,,,newest,com.anz.android.gomoney
gp:AOqpTOHsYPn13gRCorqfUkRLgwUGlfw83SrqOKJhO2JrH3XKu9mp8Lshu-ECGy-KL_R3JGgSia6705vzM3BC1xo,Natasha Fiore,https://play-lh.googleusercontent.com/a/AATXAJzhY0omKSS0SsU96J2HdldGX-tY6l-WUU3Elgnw=mo,"Always making me update, I don't like updates and shouldn't be forced to do so!!",1,1,4.35.0.0145,2021-06-25 04:36:54,,,newest,com.anz.android.gomoney
gp:AOqpTOGbCqUdOsBbp73Nw54mX2ryXidY0OX5YUA_zuaNKyVFsZmdsuleDp3K1r69DD1emrNfpa9vR88AcA_itb4,Anthony Pilcher,https://play-lh.googleusercontent.com/a/AATXAJwY52oRr3YEI11_SttS-M4IXjSPZgcT9BgdXhO9=mo,There was nothibg wrong with the old app. Why should l have to delete other apps to continue using the anz app? I was happy with the old app but you keep changing. Why?,1,2,4.35.0.0145,2021-06-25 04:29:26,,,newest,com.anz.android.gomoney
gp:AOqpTOGY_1E5ppTKbRHlCpB5QJdZnOs0US8Dl_J08q1qbfR0wHybpokp-fSeTZKyo1-kRZfYw0xgr-0_sp1nnD4,Luke Spencer,https://play-lh.googleusercontent.com/a/AATXAJwrbGjSeLQoXWeRV6OHI3BAcn1HH4yMCVUblPqC=mo,"Hate the forced updates, enough to make me consider another bank entirely.",1,0,4.33.0.0139,2021-06-25 03:45:10,,,newest,com.anz.android.gomoney
gp:AOqpTOE1NoMx95Jw_i1GYPz9oxJdV_sVUQPuTtxkCUkjHsAfHKjiu1VOHtu_eaFa56bIE7I8nmZgehFUW8YoCvM,rita simon,https://play-lh.googleusercontent.com/a/AATXAJxKCZ8Bg6UIbYpgMHzSDeyyZ5ExMq_23rSgar5o=mo,"This ""UP DATE"" for anz banking app is holding its loyal customers to ransom by not allowing us procceed to move on once we have put our pin no. in unless we accept ""UP DATE""...this is happening when i need to move money around in my accounts so i can pay my bills but it wo t let me get into my accounts, how much of a bully tactic is that, i may move to another bank, i have been with this bank for over10years, its anz banks way or nothing, no loyalty to its loyal customers...",1,1,4.33.0.0139,2021-06-24 22:01:40,,,newest,com.anz.android.gomoney
gp:AOqpTOHPqSu5lJDFRXABG6vcbfTBDIEz9a3dJIUIcl7RCmbLS0hQWKRCA14mg-Ft6VHSjXCtVpo_U-g0KH4KDBI,dennis craig,https://play-lh.googleusercontent.com/a/AATXAJxXXm3jT-r9_j-M0zdng00SW69BfHxEx4Y8BwZo=mo,Will not update or load,1,0,,2021-06-24 19:44:39,"Hi Dennis, thanks for letting us know. That's not what we'd expect to happen so we'd really love to look into it for you. Could you please email mobile @anz.com and let us know what version of the ANZ App you're using, steps to replicate the issue and include any screenshots of any errors? Thanks, Aly @ ANZ App",2021-06-25 10:14:11,newest,com.anz.android.gomoney
gp:AOqpTOEim90DQ5OuSWQ_mWdwRYsk-AU_eMu6NC_8jfynIv3TXfozfV_eTGObtdoU019nkAG0Sw4e_nBtG6gs41M,Rhys Evans,https://play-lh.googleusercontent.com/a-/AOh14GgDMZ708RCUAs76FX9crlsfg0GNw4HvYcHnKNneRtc,It doesn't work in POCO F3. App keeps auto closing before I can type in my pin,1,0,4.35.0.0145,2021-06-24 11:23:41,"Hi Rhys, sorry to hear about your experience with the ANZ App. That's not what we'd expect to happen so we would like to look into this further for you. Can you please email mobile @anz.com and kindly include your device type, operating system, ANZ App version and screenshots of the issue? Thanks, Aly @ ANZ App",2021-06-24 12:42:02,newest,com.anz.android.gomoney
gp:AOqpTOEdzxKqTBqVQ4NNICNPMGVgHhPbyMl_0IZL_2iESsdEbKwIAhIdBG1O-EHjOSaNof80qb8DMd0jv1cKJow,Alan Woodmore,https://play-lh.googleusercontent.com/a-/AOh14GizISGGTbFu2ZFD4NmjU9GuASjoSsQvrx5lqykOnA,"Just got a new tablet, cant log on to this app. It wants me to register first, and then it tells me im already registered. I cant do that because it will onlty let me add a pin and not a password.",1,0,4.35.0.0145,2021-06-23 14:23:30,"Hi Alan, thanks for your feedback. To log in with a password, press Register, enter your CRN and tap Continue. The next screen asks for a PIN, underneath this - tap 'Use Password or Telecode instead'. The screen after will let you enter your password. If you are still experiencing issues, please email mobile@anz.com and we can you help further.",2021-06-24 12:41:19,newest,com.anz.android.gomoney
gp:AOqpTOHi3mPK3oOQwgYvS8Wh-Q8zMkYfLRuMWpADQ3fzl7UHI0O_06ympgDpIy-AeUHhBxNvxBmFaYai83qucuA,Sengor Kusturica,https://play-lh.googleusercontent.com/a-/AOh14GjPqXpOonb_K7YeL_knWLi5zXcOVA6kXXBcrVYPiQ,Stop using this app. 4 embedded trackers! ANZ eventually force an update of your old ANZ app which had fewer embedded trackers. I don't want to have Adobe or Google or New Relic reading my bank account details through this app. The latest version has 4 embeded trackers: Adobe Experience Cloud Google Firebase Analytics Google CrashLytics New Relic,1,1,4.35.0.0145,2021-06-23 12:13:40,,,newest,com.anz.android.gomoney
gp:AOqpTOFBLPVdf4IBl3Lfh7D4ZRi-3-yRCrrnbV-t9UkDnBWy9khxEPAeP6CkoVbNipUUa2rxGTYHOU1BB8VaI7E,Anthony Vlachos,https://play-lh.googleusercontent.com/a/AATXAJwA4XdDe9A9XlqJaPXOqWhO5wEjX1T6ajJ_NDai=mo,Why all of a sudden I have to confirm payments via voice ID? Who on earth thought of this?,1,0,4.35.0.0145,2021-06-22 03:40:30,,,newest,com.anz.android.gomoney
gp:AOqpTOGtumwSskS4jTSXEh72kYFW7Qy4QOJp3gl3nrkz1ARaD6MTAkAef50APilntmobdPaV9VJ9n1w85avOOs0,Marilyn Daly,https://play-lh.googleusercontent.com/a-/AOh14GjD5KHeX7vE1OU0P6f3nzAuQNbwBy94opY4Y34d2w,Doesnt work had to reinstall useless app need to change my bank,1,0,4.35.0.0145,2021-06-20 11:52:55,,,newest,com.anz.android.gomoney
gp:AOqpTOG5SO7HGpa4apmnQwiACO6uiYNE2NFDdAIDS5SUoWwVosocDKhwGrsOgZwHfsUduzcx3QwvVUj8M3yfP50,Milan Kotru,https://play-lh.googleusercontent.com/a/AATXAJyJpJeDUK0GTmJTCi72nnVFa0tpX-cwZb-flF2Z=mo,To slow,1,0,4.35.0.0145,2021-06-20 03:36:07,,,newest,com.anz.android.gomoney
gp:AOqpTOF3qKfzSJfnFRrBhVvNSaVcLssUUlhYilwo3Pkb_PIfLuyVdSbSiTioI_qI0qTh8YGiALGD-0H_TIUtVn4,jan karcheski,https://play-lh.googleusercontent.com/a/AATXAJyPFxhYBPnuiPUPzA9FbxSvi4A9eLpyg9lq7gnz=mo,Rubbish can't log on no one seems to know how to help I have reload the and it is still the same asking me to log on welcome new customer which I am not,1,0,4.35.0.0145,2021-06-19 08:04:53,"Hi Jan, sorry to hear about your experience with the ANZ App. That's not what we'd expect to happen so we would like to assist you further with this. Can you please email mobile@anz.com and kindly include steps to replicate the issue and screenshots of the issue? Thanks, Aly @ ANZ App",2021-06-22 15:08:03,newest,com.anz.android.gomoney
