reviewId,userName,userImage,content,score,thumbsUpCount,reviewCreatedVersion,at,replyContent,repliedAt,sortOrder,appId
gp:AOqpTOFr3MLAWe66sGJb0TeHHnPbyitDMNAY_P0182y0H3odUbrx_wxVY1bc8KJFFbQWjftgG9ZsMy5LW9OblZ0,Daniel Grey,https://play-lh.googleusercontent.com/a/AATXAJy9c_LVVinhp1HKuwgBpBoAdYLihopeEFOvAUoD=mo,Would like to see a time shown for each purchase made when reviewing purchases in app.,3,0,4.32.0.0137,2021-03-31 08:40:42,,,most_relevant,com.anz.android.gomoney
gp:AOqpTOFtAae0Fvwbs8nlFguNEx_cLGRZxp5_TlZMFI5tFLeZCsf7LG5882Gks0nqmDo_UTaYiv6zpmx8rtrimZc,Nathan Nadalini,https://play-lh.googleusercontent.com/a-/AOh14GhHJzWRswV5tVh4f5HodXp-WbDYn0qb1tBcSc7m,Good app easy to use..... but why can ios users access their share trading accounts and we on Android can't it is rather annoying and inconvenient,3,0,4.31.0.0136,2021-03-01 07:50:20,,,most_relevant,com.anz.android.gomoney
gp:AOqpTOGCxaZS2aIZPAIDKuH_5A644l2rP_Q1sZoBYmaG8WH_-o5TBeSekVDTdi7DKx47kv_prr9R7xBhMrBy6cw,Mariela Edgar,https://play-lh.googleusercontent.com/a/AATXAJwklYnC10cFpaKKmmt5HnhkjbN0kC5tZG2H28Gu=mo,It's basic but handy. Don't like not being able to deactivate accounts.,3,0,4.31.0.0136,2021-02-14 03:15:13,,,most_relevant,com.anz.android.gomoney
gp:AOqpTOG58Lx96_ZW9Cq8sJn5abXkUssvkOp9OY37LYGMZcTzoH7WcFSoazfyZIhfok1pPGpf-Mk8Hiz34FF_42s,Nick Leach,https://play-lh.googleusercontent.com/a-/AOh14GiWXmYbMRXqsF9n2lm8eA9tXCrvLh-6hN-5Utne9Q,Ok for quick basic stuff. Slowly improving functionality.,3,0,4.32.0.0137,2021-04-15 11:28:16,,,most_relevant,com.anz.android.gomoney
gp:AOqpTOEL5P4ZdDH8UuikPf0B0K_pbOSzKgiDYNgN3xzzlZ13YSWGUUezuV3GVyQ2laEmonlxf3EaLyJmB_k5dGw,Shailendra Baral,https://play-lh.googleusercontent.com/a/AATXAJwibqEblQfgAeZFE5CkvlMKZ-prK91-CQhstZYi=mo,"Need features like transaction alert/ notification, simle.balance.",3,0,4.31.0.0136,2021-02-18 10:17:30,,,most_relevant,com.anz.android.gomoney
gp:AOqpTOGvCfQIRKXjizGsepEtcluRtjz5jAzMPCFZ65ne0gYIE43VTxdIVDl7E2FmCdEOKxBUyZFWKL0NMnTkEqM,Rachel hayden,https://play-lh.googleusercontent.com/a-/AOh14GhkU7tz1dWm2jqCiQdTC5QZX31jUF64xkXs_XDItg,Can't transfer from one account to another on my phone but hubby can on his.,3,0,4.33.0.0139,2021-05-01 12:03:27,"Hi Rachel, sorry to hear about your experience with the ANZ App. Can you please provide these details to mobile@anz.com so we can assist you: Mobile Number, Device type - Brand/Model, Operating system, screenshots of error messages (mask personal information), steps to replicate error and a copy of review for reference. Thanks, Aly @ ANZ App",2021-05-07 13:06:41,most_relevant,com.anz.android.gomoney
gp:AOqpTOEiT8qF_yY2S94tHnXEY80mI6SqeSWspL9J9EM14BvUU4LQODTnFlMEwOXWC-TSdL-hT0g9mc8DNcTIWoA,Aaron Spoljaric,https://play-lh.googleusercontent.com/a/AATXAJyNOQSgfM8YQaRHZOOLAj2OObRxuQE8IFgT-jIj=mo,"I did rate this 5 stars, but after doing so none of my accounts would load... changed my mind",3,0,4.31.0.0136,2021-02-19 12:29:31,,,most_relevant,com.anz.android.gomoney
gp:AOqpTOEh5nlPC0Uw9lqOm5yIg6--IhnL7cG3XIAcL1DH-_no0Syg5XGgymaFTkCu4z1UhaUBiCHOYxXY3n3XVeY,Linda Simmonds,https://play-lh.googleusercontent.com/a/AATXAJxaiaHWjQhenqB9F0h4eF2dpxZEM9R7bgrG4wc=mo,Good clear and getting better,3,0,4.34.0.0141,2021-05-30 07:04:33,,,most_relevant,com.anz.android.gomoney
gp:AOqpTOHt8w41oomvIF9qwzZsh3vNa2DFeOPzsTAEZeAmKcEe0Qu4LbVxKH56U-nUvyq-UXRfc5c0nWgtqbkYmC4,Deamand Mandy1,https://play-lh.googleusercontent.com/a/AATXAJzt3sBDYVZyRp3w-M802iCQEz5Ry_BOo3CC4M7p=mo,Not as good as the commbank app. Can never know my true balances with ANZ,3,0,4.32.0.0137,2021-04-13 04:55:13,,,most_relevant,com.anz.android.gomoney
gp:AOqpTOG6gFDw-2h42af10I4MlpIGuQ39mqrHvsFxeDGzgCCXvMb619tQUponVuXmMATzeM49tPDOHDimJXU3rZk,john tiller,https://play-lh.googleusercontent.com/a/AATXAJy9H9o_vN7nSAY1C79Wh5zbKtpc3-4N_8Lbdygp=mo,Not as good or easy to use as CBA app,3,0,4.34.0.0141,2021-05-14 09:25:28,,,most_relevant,com.anz.android.gomoney
gp:AOqpTOHPQTQOpCzu4TdPtWkEL9F2__kbNhr_miR_Pj83AQWpf8lFUFm2mz1buMDsdA60s0STa4nhA1Eb4a3EbTI,Pete C,https://play-lh.googleusercontent.com/a/AATXAJz56_SHxVa6xNm5Z9jxNoNlsOw3CV1mdX9Ms6yMpg=mo,"Not too bad, if they had a share trading platform in this app it would be great.",3,0,4.32.0.0137,2021-03-29 05:15:36,,,most_relevant,com.anz.android.gomoney
gp:AOqpTOFOiADKoEpoCT7PigES7CXzgfyfmcJ6qX4p261QayAHLFRM6FGaSskWZhAAKPVneKF5nuAeVZqCW63atTc,Maria Louise,https://play-lh.googleusercontent.com/a-/AOh14GgvzbLlfTWPoWiiSbN0cuRCXLzF3W3Y0OVbgfmtKw,Just wish it would send me notif whether I received any money. I did enable notif button and all that but this app still wasn't giving me any notif. Hope you could make this work. Thank you so much!,3,1,4.30.0.0110,2021-01-07 05:45:40,,,most_relevant,com.anz.android.gomoney
gp:AOqpTOERRIOQUx4EEW570aTTkvtDXm-I2uXAhgXfVPxHsj_oWCuWRxs8R5H7uiROh6olypHo_WAMGmzD1syYIcU,Bevan Ward,https://play-lh.googleusercontent.com/a-/AOh14GjaSK6FS2E8PNXQ7n2oNyIEpkfQVY2at3-maw_J3Q,"Only issues are, not able to schedule future payments like other banking apps. And 1k daily limit on app when there's a higher limit on the Website with no option to change",3,1,4.30.0.0110,2021-01-19 09:05:19,,,most_relevant,com.anz.android.gomoney
gp:AOqpTOHK-_cvBtm1yqGvYhZgjnkvtyk6z3EEY0HVN6AzbggLyUCDcLpOEgDGP0IjbHYtA1p9onx0iB1VEZIqsT0,James Druwen,https://play-lh.googleusercontent.com/a/AATXAJy3yRp6burfYoNbWcg45OYvNMrISXWuiLrrl-gW=mo,"This app does the basics excellently and I find the simple design very pleasing. However I find it very lacking in features, observing my friends Commbank app I saw that you can view a breakdown of expenses such as entertainment, food, fuel, etc. I hope this feature is implemented in an update soon because in 2018 you'd expect to be able to plan your budget through a mobile banking app.",3,2,4.5.0.0140,2018-09-13 17:54:56,,,most_relevant,com.anz.android.gomoney
gp:AOqpTOHLLXXeeukoCoPC__wT6GqbgyD9zLvwfuQ2zWi_G-RXyyxSk6ASS-NNzXQvi0CIChfi1ZVclaUYENW-b2Y,Jessie W,https://play-lh.googleusercontent.com/a/AATXAJyDYD4sD6X9Z4hSBFGKAL2XMjNlaveqoXSnZcqL=mo,"Gets the job done, however the product & UX team definitely needs to run some user testing. why is ""personalise"" and ""activate card"" two of the three main buttons? This should be obviously given to the most important features: checking your spending, paying off your spending, maybe even a how many days left to pay back your cc? Please take a look at Commbank or any other fintech app.",3,0,4.10.0.0212,2019-02-07 17:21:50,,,most_relevant,com.anz.android.gomoney
gp:AOqpTOEuB_F08DpjvK9mQbx6FH3iDW_MY-KrCF5ifkmxsIl84q84FvCDhEnJDVTB0eSB14tIV12R37Tp99ALNFc,A Google user,https://play-lh.googleusercontent.com/EGemoI2NTXmTsBVtJqk8jxF9rh8ApRWfsIMQSt2uE4OcpQqbFu7f7NbTK05lx80nuSijCz7sc3a277R67g,"I was really torn about giving a 3 star review, up until the last couple of days, i havent had an issue with the app but the last 2 days I cannot login, quite inconvenient if you're in desperate need to tranfer funds quickly because now you have to muck around and go to online banking to do whatever you need to do ANZ PLEASE FIX THIS ASAP",3,1,4.5.0.0140,2018-09-19 19:04:10,,,most_relevant,com.anz.android.gomoney
gp:AOqpTOEO3W-XUO9chXIADAbDtVtO_phDOp3nSxZhlGj2W7m5d3cQZyyMDe_g9jki0wm3yIDQKnNw2v4XjevWY9w,Mathew Harrison,https://play-lh.googleusercontent.com/a-/AOh14GhmWIYb5mOtUDLOBkN4nN9HfK_zI1WLgoMWszY3OA,very simple app that works fine but could benefit from some more features. could could you incorporate a feature to allow notification when travelling overseas like the nab app. much easier than having to send email every time. also be good to be able to get account summary to see what my current interest rate is for home and investment loans.,3,1,4.11.0.0224,2019-03-21 07:52:41,,,most_relevant,com.anz.android.gomoney
gp:AOqpTOEoLMj06pLfmChC5NuaLlGgOvC23r7pice_xA1wLhCyAKJM6q0evaKbI0NqupqTIhN0lMoxxgerrMRyuXc,Kerry Jean,https://play-lh.googleusercontent.com/a-/AOh14Gh6B-7Cd2LkWxSmTCNVapnXTNABO6kNoc7lXM6m,Brilliant. Extremely helpful. Well it would be if my transactions were actually kept in the actual order that they happened. Someone or something often changes them to different days. Not happy. Has caused me to be charged debit interest and probably missed out on some credit interest. Shouldn't have to be worried about such hassles.,3,8,4.24.1.0073,2020-07-07 12:16:25,,,most_relevant,com.anz.android.gomoney
gp:AOqpTOG96sI9aPJi_pnhAMN1vUeH9kJFo0mlN5mWITY_40XtGLBQJfl0J0cJM9YmKmGEgsNSu5No7FIJFtQTF6I,Adrian Le,https://play-lh.googleusercontent.com/a-/AOh14GiSKt8vOJ53Y6y0mR2xUb7C4PrNtnAMFA-Z044G,I had to use ANZ for the first time but have always been with CBA. I always assumed the functions were standard across the board but this app is not even compatible with phone tap and pay and doesn't have the option to turn on notification when funds enter and exit your account. Really disappointing as this is extremely useful.,3,9,4.12.0.0230,2019-03-24 06:49:11,,,most_relevant,com.anz.android.gomoney
gp:AOqpTOHXHfvdrT50zOJXZsv-sZ55VH-Em5UAg20s0iXfuYrIfrpfLQd5QSQUw8hApxiI_tqMlVu69ahBo40ChUU,Leonie Bolton,https://play-lh.googleusercontent.com/a/AATXAJz41vZzyPLfipqfK7OzgEUW0gpQ2q7nRj-JJkWM=mo,"Generally a good app, but after the update 2 days ago my 'available funds', on my loan, now displays as zero. I rang them and got a fairly standard procedure answer. And that I should call back if I still have issues. And yes 36 hours later, it is still zero balance. Not good enough. These are distressing times to be mucking around with people's funds. Unfortunately, the reply from ANZ DOES NOT answer the question. I didn't ask to redraw funds, I asked why the available funds now show zero.",3,16,4.24.1.0073,2020-06-08 14:05:30,"Hi Leonie,

Thank you for your feedback.  Unfortunately the home loan redraw feature is not available in the ANZ App.  You can redraw funds from your home loan using this feature in ANZ Internet Banking.

Apologies for any inconvenience.

Regards,
Georgie @ ANZ App",2020-06-08 13:51:16,most_relevant,com.anz.android.gomoney
gp:AOqpTOHv9iM9dG2OH1fc_LaQKbBAgEetS5Y4kAzXcxrJDZ8kg9M7_SZEOS-e_gM77LJ7W9GbG9Lvd0RY4Wp8uN0,David Scott,https://play-lh.googleusercontent.com/a/AATXAJx6QXlkeFyqUY6y78q1fxeL29M2dcARTrpYDZQj=mo,app has stopped loading on my phone. worked fine for a long time and now won't get passed the spinning circle. have uninstalled twice now and works for a day then stops. using an oppo phone. not sure what else I can do. hopefully it will be fixed and I can start using again.,3,3,4.10.0.0212,2019-01-22 03:35:09,"Hi David,

Sorry to hear about your experience. Please provide the following details to mobile@anz.com, and we'll look into this for you.
•Name
•Mobile number
•Device model
•Operating system
•Screenshots of any error message

Regards,

Sam @ ANZ App",2019-01-22 10:26:30,most_relevant,com.anz.android.gomoney
gp:AOqpTOEfy-Y8guELpcZ7id1qB0sLQz96TUUvWQ-LcMjFOadFd6yEclz4oV9ldf-oTxnl6Tfa0DG7xsTCsEK9hns,Oleg Sannikov,https://play-lh.googleusercontent.com/a/AATXAJxiD9rklp1bB-NtnNwcUjP_ntp4UXV6CqWwPECp=mo,"It was an OK app previously, but obviously they have software developers who are busybodies and who make unnecessary ""improvements"". Previously, when you don't use the app for a few minutes it would kick you out and the screen would appear saying ""use finger touch or pin to login"". And you simply touch and get in. Recently they introduced a new screen on top of that. So first you have a screen saying ""you've been logged out, log in again"" and you have to touch the ""log in"" button, which would bring you to another screen for actual login - that old screen I described above. What the hell for???? Why do I have to waste time to press another button and wait for another screen to load?? It was perfectly clear previously that if you see a ""touch or PIN"" screen then you have been logged out. Why another unnecessary annoying screen? Please remove and tell you developers that they are stupid.",3,4,4.25.0.0085,2020-07-25 08:24:47,,,most_relevant,com.anz.android.gomoney
gp:AOqpTOGAwI54uVuToD5bpaLzBp42t9J2wowOsBcWe3RQ3V_XJfELcHbODFDFJMD0T_DOE90bw9nzq04dB-12Vvs,Amy Neale,https://play-lh.googleusercontent.com/a/AATXAJys-TFF1oLNiktmLAa1TCWyfn_QNzrIHYyTHS-7=mo,"I've only used the internet site to login previously. The app is backwards to that. Where you find your current available dollar amount online on the right of the screen, it tells you the current balance with outstanding transactions on the right of the screen in the app. First time user as I left my card at home a had to set it up manually. I was confused with how much was in my account and was pretty annoyed when my transaction didn't go through at the checkout, thinking I had more than I did",3,47,4.30.0.0110,2020-12-13 17:08:45,,,most_relevant,com.anz.android.gomoney
gp:AOqpTOFMlOVqb4nPU20TqYUFObdkJ1izZvcZH9lRsSPAdX_vMb7qv7VOWCQHxOJb1MDi6PnSmV2NmPpqNUZFzsg,Luke J,https://play-lh.googleusercontent.com/a-/AOh14GiBWeVr1CDyBMeM2fmz3b9LKDGyZnyAIF-XO7hLGA,"No one cares about CURRENT balance!! the only balance that is useful to the average user is the AVAILABLE balance. This is the balance that should be displayed and available at a glance, with out having to click into each card to see how much money you actually have to use. would be 5 star except for this glaring design flaw.",3,4,4.14.0.0248,2019-06-03 03:38:15,,,most_relevant,com.anz.android.gomoney
gp:AOqpTOFHmSYlgdZSZLrMxBfWojLuS0TE05Wya07B2pD8ftZwi7MMPhdZTCgna4AikRWeOdLoZlXQg4nyWgHa5-Q,Nada Allan,https://play-lh.googleusercontent.com/a-/AOh14GgZzRY2Z1uCNypcSJJGHzxh2HNB7maF-jU4H4pI0Q,"I've been using the ANZ app for the past 2 years and have really loved it, unfortunately the past month it has not been working for me, I've uninstalled the app 3 times and reinstalled it but it comes up with the same error, which is it's unavailable and to contact ANZ. My phone also had an update to Android 10 in between this and I was hoping it would resolve the issue but it hasn't.",3,0,,2020-07-03 15:32:52,"Hi Nada

Sorry to hear about your experience. Please email the below details to mobile@anz.com so we can assist you:

CRN
device type (brand & model)
IP Address (visit whatsmyip.org)
exact description of issue (after reinstalling, can you reregister or do you get error immediately?)
screenshot of error message (if possible)

Regards
Georgie@ANZ App",2020-07-06 04:18:56,most_relevant,com.anz.android.gomoney
gp:AOqpTOFFfLmthy88ea7_JuE_Syz5wWB4daJHf9QrEIhPDBtZgw6Clvrw3fZ9AJgmDIf6lTF3mKK_pPb5wM7epD8,Luke Rosenbrock,https://play-lh.googleusercontent.com/a/AATXAJw7_3W3TyyQp-lUcJxVBRn8Pm14XKX69AZ4I2aY=mo,"The app is pretty good. But the ANZ Grow app that was prior to this being released was much better. In the Grow app I was able to access the details for each of my ANZ Insurance accounts/policies. Which gave me a sense of better connection with my finances, it was more holistic. This current app lacks this capability. It leaves me feeling disconnected from other ANZ products that I am subscribed to.",3,3,4.12.0.0230,2019-03-27 06:19:19,,,most_relevant,com.anz.android.gomoney
gp:AOqpTOGH2fPt5pBolaeD8ZCbMy7v6vzcxrCRQIzyOpBDpX-bUgvmZyln5MDXbUbWK05XKGHVXba8U3CBJmZTuOw,Jason Mark Roehrig,https://play-lh.googleusercontent.com/a-/AOh14GjgZyyB_P8jr_4ITy_JZyKLZcs-4PDyxzeUl69M0g,"it lacks vital features. Annoyingly these are available in the iPhone app. For example, if you receive a BPay bill you can't view or pay for it with the app, which is very annoying and why I gave it three stars. Otherwise it works well.",3,0,4.13.0.0237,2019-04-18 14:00:15,,,most_relevant,com.anz.android.gomoney
gp:AOqpTOGs-sgo2DpWgjvMDgzxvMRvokQOli8QN37XjuR7GhGiY5vDa3aOtPYN3FZbMP-e39bnqRCaZN5ufLEpxms,Kye Rees,https://play-lh.googleusercontent.com/a/AATXAJyinh44qBhIQv4oYroVib-CSyrJ1kHq2RgBKgep=mo,Disappointed with how basic the app is. Please allow us to access our redraw and see our redraw balance through the app. This is one of the biggest benefits of variable loans and we can't do anything through the app. Also it would be great to receive notifications for transactions/purchases on your every day account.,3,1,4.24.1.0073,2020-07-02 17:46:33,,,most_relevant,com.anz.android.gomoney
gp:AOqpTOH285oJ1BU-jeuUH-wGi6Z7bK4XsRJUqlsbCxFuwE-bTCsVy_lTqpJ2-REzu6O_yfnUgnZMIPaRF1br1FE,Ian Parkin,https://play-lh.googleusercontent.com/a-/AOh14GiMJIfeveKPRj14sdhnqUvDuk2J6kk9Ghd2Yu6B8Q,"has not worked for weeks.- UPDATE: I uninstalled the app, then installed again. Now working again. Last update must have gone wrong somewhere. Reading online I am not the only one who had this problem. Was there another cockup update? It's gone pearshape again!. Am I going to have to uninstall and reinstall after each update now?",3,4,4.11.0.0224,2019-02-21 16:59:59,"Hi Ian,

I am glad to hear the ANZ App is now working for you and I hope you enjoy using the App

Kind regards, 

Sam @ ANZ App",2019-01-23 04:37:53,most_relevant,com.anz.android.gomoney
gp:AOqpTOFUpZJfZVgUnluNk-gs5C2p2kwtyzP0kcL3GTljYPoA3A4QZ_UbE0RlZFrvYe5fuUAJq9VIKjM0pvDAGm4,Azz Brah,https://play-lh.googleusercontent.com/a-/AOh14GjzAFQOKT5-jO0zO6GWF4GC0RetubC_N7wuVvyYdQ,"The app definately does the job but could be a little more user-friendly. Please consider adding a few more desktop-exclusive features such as managing recurring payments. Being able to set up weekly budgets on the new ""Spendi"" feature would also be great, rather than only daily.",3,0,4.10.0.0212,2018-12-20 11:04:21,,,most_relevant,com.anz.android.gomoney
gp:AOqpTOGs6y_YEqEXhmKJHZELp2eHBxWprxBEEu_34-2j64_NObzUqvDT6IRc6O1ctX89ZLbktJAYtYi3h8j1h2I,Just Share,https://play-lh.googleusercontent.com/a/AATXAJxzRAdyVTjtpLOQ6Ln48-wOavSGjpW4WYeSglyV=mo,"PayID now available so Thanks. Also have same problem as the other review 'Somerhing went wrong...' after updating to android 10. I had to reinstall and re-sign in with internet banking credentials. **Issue with ""something is wrong..."" Just few other users. Need to uninstall or clear cache+data and re-register for it to work again. Just updated to latest version after the re-registration. Hope this will fix it",3,4,4.25.0.0085,2020-07-15 13:25:03,,,most_relevant,com.anz.android.gomoney
gp:AOqpTOERwQK5uEY8qi7QqdHNHVVjwTFMWLx6I6SZmQ13DG06UQrUoJDrh0p7j9tIoiiuFPgX8m8YRm2ScjOWBAQ,Marnie Datson,https://play-lh.googleusercontent.com/a/AATXAJxSSv5BVYG-qP5RG4Igmeqjo0s-EaNYfLnRkjJd=mo,"previously no issues, however the new update leaves one of my accounts unable to load the transactions. 2 of my 3 accounts load fine, just 1 doesn't. So full app isn't terrible but clearly a glitch somewhere. however once this gets fixed I'm sure I'll be back to loving / appreciating this app..it's easy to use, load n moves between accts quick, able to do almost all that you can from desktop login",3,3,4.15.0.0255,2019-07-04 11:55:30,"Hi Marnie

Sorry to hear about your experience. Please provide the following details to mobile@anz.com so we can look into this for you.

•Mobile number
•Device model
•Operating system
•Screenshots of any error message
•Steps to replicate the error
•Which account is not loading transactions? Is this an intermittent issue?

Regards
Georgie @ ANZApp",2019-07-07 15:15:22,most_relevant,com.anz.android.gomoney
gp:AOqpTOH7AtHuz9yRh1RCfUtySWRhgnrlQEJlhv8Kiw3t8yQUa9KBa59FFreQZXpJH9EN07QlGBIPpfWjfe9dohY,Ali Dad,https://play-lh.googleusercontent.com/a-/AOh14GjdlP0__yoAh7I9gzKOOjVKyKpswWim2sgD9sEB,Overall good and Easy to use but my only biggest concern is I can't see transaction details. It shows only amount and date and no more. That is why I am using commbank App and doing all my transaction through them. If you update your app I am surely going to use this one more often.,3,0,4.10.0.0212,2019-01-12 11:42:27,,,most_relevant,com.anz.android.gomoney
gp:AOqpTOFngiJttBw6aH73suInfFrxrwpdJGeBIBRW1M7Ht3L463cGu1EszvNKIYtztmMeJNB7g7ZEnuSZHPpNhJE,Yogesh Gore,https://play-lh.googleusercontent.com/a/AATXAJztBBJFnXAFcZ9_S3Pi3rMlGNzjKtFi_-bF4taL=mo,"Not very user friendly. Two main issues. 1. I can see only the latest balance. Why can't I see my balance after every transaction? 2. I can't make future dated transaction like I used to do for CBA and ING. If these two issues are fixed, I will be happy.",3,5,4.28.0.0101,2020-11-01 17:36:43,,,most_relevant,com.anz.android.gomoney
gp:AOqpTOEShSigUXf5g1XX2gEjiwp_r6Aw31kgWBygkc3G3q-ezF17RQ3izuD3YFXZ0QBH-uiPPnCnJemjFWpoHdk,Sweetpandora_77 203,https://play-lh.googleusercontent.com/a-/AOh14GjJsx-1cEzD7A1bd6V78vFv6ISiZQIj9qG1P_-d,"I've been using this app for years with no problems even after I moved overseas. I am still overseas (in India) but for the last week, I am unable to access the app at all. I reinstalled it but I still can't access anything after I click on open. I just get a blue screen and nothing else. Is the app under maintenance? This so frustrating. I would really like to access to the app again as it makes it so easy to transfer and make payment from my phone.",3,0,4.27.0.0099,2020-09-22 18:55:44,"Hi Sweetpandora_77 203


Sorry to hear about your experience. Can you please provide the following details to mobile@anz.com so we can assist you:

•Full Name
•Mobile number
•Device type (Brand/Model)
•Operating system


Regards,
Georgie @ ANZ App",2020-09-23 06:58:54,most_relevant,com.anz.android.gomoney
gp:AOqpTOF3X4hEAslxLN8C-0n6bWTZmuanPo8932SZPzDilcXiUA8mQ7JTf-xgHITlIf4uTNM_MmrhtJGjYMFG8o8,Ree Bear,https://play-lh.googleusercontent.com/a-/AOh14GiT2JDTZ_ddGbyIaqN0DlpfD40vkA0rEKTBjALS8g,"usually good otherwise but recently having troubles with the app not loading and with no error message. Have installed, re-installed and updated. If you are upgrading the app and it is a bit heavy for older phones you should state this. Because this is what I suspect.",3,4,4.12.0.0230,2019-03-21 15:30:26,,,most_relevant,com.anz.android.gomoney
gp:AOqpTOGQOwM3m6HNON_lTpYrVs_kvMoYqmmEkdQoOiEMto__TEiuB4T1b5X32naT8PhR73b2KGIVEvOrKRkYzIM,A Google user,https://play-lh.googleusercontent.com/EGemoI2NTXmTsBVtJqk8jxF9rh8ApRWfsIMQSt2uE4OcpQqbFu7f7NbTK05lx80nuSijCz7sc3a277R67g,you need to be very careful when sliding to transfer to other accounts. You can reorder so regular tranfer to accounts line up first but took a while to work this out. Found little care factor when payment was made to Credit Card instead of Mortgage.... ANZ don't like reversal transactions made in error ... .,3,0,4.11.0.0224,2019-03-16 03:05:28,,,most_relevant,com.anz.android.gomoney
gp:AOqpTOGMtCOzCF8WXJ1hI_3sdbXqJOneFv7gY1o8_c2KyiJNT2oNfhQ-MDzh1Z2QmciaATt4jEALOzNYU-Zrrzk,Brendan Temme,https://play-lh.googleusercontent.com/a-/AOh14GiXAv2K-sAh1QYOyZrBEjTlHFa4i-o4yuYOKrYFlA,"Great but now has issues. In the last 2 months or so, it has randomly been giving me the message ""something wen't wrong"" call customer service etc when I try and open the app, and the only way to get rid of this is keep uninstalling and reinstalling the app. Maybe this should be looked into.",3,8,4.25.0.0085,2020-08-10 04:38:54,"Hi Brendan

Sorry to hear about your experience with the ANZ App. Can you please provide the below details to mobile@anz.com so we can assist you:

•CRN/mobile #
•Device type (Brand/Model)
•IP Address (visit whatsmyip.org)
•Date/time of issue


Regards,
Georgie @ANZ App",2020-08-10 10:19:39,most_relevant,com.anz.android.gomoney
gp:AOqpTOH996z3fIZLEwuXeC3R6pemGFCc7IlkLt7gBuaZ9YZEjvVF1wA9_759ZBUmW2WUmr3GUeF2ZqMNvYAsr6k,Horror Vacui,https://play-lh.googleusercontent.com/a-/AOh14GhOJXfwcB4ZMfOqFUAiXhgPs5MN8wpKUwiH9FBpXw,"Not bad but it's annoying that if you want to open a new account and supply your birthdate there is no type option you have to flick through all the months and years, imagine being 80 opening an account and having to scroll through 80 lots of 12 months? I had enough annoyance and I'm only 35. On a good note I do like that you can make Savings goals and it tells you the progress percentage, makes saving money more fun",3,14,4.28.0.0101,2020-11-03 12:36:58,,,most_relevant,com.anz.android.gomoney
gp:AOqpTOE1woeRuHGW7JMZ1ukrZEcixnsi_i9ze61C0kSxPGDXcfNPLKzQLead47WrA1cYu-5TNMC94ntlgcnZca8,Proto,https://play-lh.googleusercontent.com/a-/AOh14GiQyWgx2TSYkLgoMfIJhtEqjm632YmA9McXEmRFqw,Does the job but it's pretty basic. You look at other apps like comm bank and westpac. Their have all their apps in one. Here with ANZ they have two seoerste apps for their Android Paypass. Seems silly to me. Why not pack it all into one app instead.,3,10,4.9.0.0206,2018-11-22 21:58:29,,,most_relevant,com.anz.android.gomoney
gp:AOqpTOESx7I9-37dyzE8YsF_QOCM3stgRXdTUdtehSuhqOJt2bPJEZBv1u_S9FpDt0yj8w2RbABuWRr_NbwyqJI,Prats Raul,https://play-lh.googleusercontent.com/a-/AOh14Gi2BeUPJUVkxWEjFligbbEXnZZAdodBe2O-9w0iCQ,"This app is good to use overall however, for some reason, ANZ does not provide a widget which is so disappointing considering that both commbank app and NAB app have widgets to check balance. This app deserves a five but because of the no widget feature, I give it three stars.",3,0,4.17.0.0264,2019-08-16 11:27:59,,,most_relevant,com.anz.android.gomoney
gp:AOqpTOGiZmHpdnZ8auEeDQlK41Znq-ejZcQ4TuTZfy96S4nXEweI6xr_PnjDfxUr0jBVEKTV-8wO7WN_ezeNdVs,Jacob Muir,https://play-lh.googleusercontent.com/a/AATXAJy4itlF9fC6Omi7KUVY6AC5y-BBwK-aRS_MtiE2=mo,"sometimes stops working and that needs to be fixed before I can give you the amazing 4 stars. I was stuck at a reject shop trying to buy a cheap container and the app stopped working. Garry the mantis needed that container, now Garry the mantis is forever lost and so is your 5th star.",3,1,,2019-02-28 10:35:34,,,most_relevant,com.anz.android.gomoney
